,tweet_id,timestamp,source,text,rating_numerator,rating_denominator,name,nickname,jpg_url,img_num,favorites,retweets,dog_label
390,809084759137812480,2016-12-14 17:16:53+00:00,iPhone,"This is Wallace. You said you brushed your teeth but he checked your toothbrush and it was bone dry. 11/10 not pupset, just disappointed https://t.co/nadm8yWZ4h",11,10,Wallace,False,https://pbs.twimg.com/media/CzpyM41UoAE1b2w.jpg,1,14685,4046,Vizsla
391,808838249661788160,2016-12-14 00:57:20+00:00,iPhone,This is Ito. He'll be your uber driver tonight. Currently adjusting the mirrors. 13/10 incredibly h*ckin responsible https://t.co/Zrrcw29o13,13,10,Ito,False,https://pbs.twimg.com/media/CzmSFlKUAAAQOjP.jpg,1,11271,3536,Rottweiler
392,808733504066486276,2016-12-13 18:01:07+00:00,iPhone,Here's a pupper in a onesie. Quite pupset about it. Currently plotting revenge. 12/10 would rescue https://t.co/xQfrbNK3HD,12,10,,True,https://pbs.twimg.com/media/Czky0v9VIAEXRkd.jpg,1,8784,2509,Toy Poodle
393,808501579447930884,2016-12-13 02:39:32+00:00,iPhone,This is Koda. He dug a hole and then sat in it because why not. Unamused by the bath that followed. 12/10 https://t.co/SQhyqrr8px,12,10,Koda,False,https://pbs.twimg.com/media/Czhf4XtVQAAIqpd.jpg,2,12595,3007,Airedale
394,808106460588765185,2016-12-12 00:29:28+00:00,iPhone,Here we have Burke (pupper) and Dexter (doggo). Pupper wants to be exactly like doggo. Both 12/10 would pet at same time https://t.co/ANBpEYHaho,12,10,,True,https://pbs.twimg.com/media/Czb4iFRXgAIUMiN.jpg,1,9701,2525,Golden Retriever
395,808001312164028416,2016-12-11 17:31:39+00:00,iPhone,This is Cooper. He likes to stick his tongue out at you and then laugh about it. 12/10 quite the jokester https://t.co/O9iGgvfuzl,12,10,Cooper,False,https://pbs.twimg.com/media/CzaY5UdUoAAC91S.jpg,1,14015,4098,Labrador Retriever
396,807621403335917568,2016-12-10 16:22:02+00:00,iPhone,This is Ollie Vue. He was a 3 legged pupper on a mission to overcome everything. This is very hard to write. 14/10 we will miss you Ollie https://t.co/qTRY2qX9y4,14,10,Ollie,True,https://pbs.twimg.com/media/CzU_YVGUUAA3Xsd.jpg,3,16236,4288,Golden Retriever
397,807106840509214720,2016-12-09 06:17:20+00:00,iPhone,This is Stephan. He just wants to help. 13/10 such a good boy https://t.co/DkBYaCAg2d,13,10,Stephan,False,https://pbs.twimg.com/ext_tw_video_thumb/807106774843039744/pu/img/8XZg1xW35Xp2J6JW.jpg,1,107015,56625,Chihuahua
398,807010152071229440,2016-12-08 23:53:08+00:00,iPhone,This is Lennon. He's a Boopershnoop Pupperdoop. Quite rare. Exceptionally pettable. 12/10 would definitely boop that shnoop https://t.co/fhgP6vSfhX,12,10,Lennon,False,https://pbs.twimg.com/media/CzMTcZoXUAEKqEt.jpg,1,14514,4418,Golden Retriever
399,806629075125202948,2016-12-07 22:38:52+00:00,iPhone,"""Good afternoon class today we're going to learn what makes a good boy so good"" 13/10 https://t.co/f1h2Fsalv9",13,10,,False,https://pbs.twimg.com/media/CzG425nWgAAnP7P.jpg,2,75639,37911,Cocker Spaniel
400,806542213899489280,2016-12-07 16:53:43+00:00,iPhone,This is Waffles. He's concerned that the dandruff shampoo he just bought is faulty. 11/10 tragic af https://t.co/BCB87qUU0h,11,10,Waffles,False,https://pbs.twimg.com/media/CzFp3FNW8AAfvV8.jpg,1,11363,2752,Vizsla
401,806219024703037440,2016-12-06 19:29:28+00:00,iPhone,We only rate dogs. Please stop sending in non-canines like this Freudian Poof Lion. This is incredibly frustrating... 11/10 https://t.co/IZidSrBvhi,11,10,,False,https://pbs.twimg.com/media/CzBD7MWVIAA5ptx.jpg,1,7145,1388,Chow
402,805932879469572096,2016-12-06 00:32:26+00:00,iPhone,This is Major. He put on a tie for his first real walk. Only a little crooked. Can also drool upwards. H*ckin talented. 12/10 https://t.co/Zcwr8LgoO8,12,10,Major,False,https://pbs.twimg.com/media/Cy8_qt0UUAAHuuN.jpg,1,9178,2209,Norwegian Elkhound
403,805826884734976000,2016-12-05 17:31:15+00:00,iPhone,This is Duke. He is not a fan of the pupporazzi. 12/10 https://t.co/SgpBVYIL18,12,10,Duke,False,https://pbs.twimg.com/ext_tw_video_thumb/805826823359631360/pu/img/yr_fF0TZCR-B70p2.jpg,1,7335,2132,Siberian Husky
404,805520635690676224,2016-12-04 21:14:20+00:00,iPhone,This is Zeke the Wonder Dog. He never let that poor man keep his frisbees. One of the Spartans all time greatest receivers. 13/10 RIP Zeke https://t.co/zacX7S6GyJ,13,10,Zeke,False,https://pbs.twimg.com/media/Cy3IvdZXgAUoEaj.jpg,1,6368,1905,Malinois
406,805207613751304193,2016-12-04 00:30:29+00:00,iPhone,This is Shooter. He's doing quite the snowy zoom. 12/10 https://t.co/lHy4Xbyhd9,12,10,Shooter,False,https://pbs.twimg.com/media/CyysDQlVIAAYgrl.jpg,1,8680,1972,Pembroke
407,804738756058218496,2016-12-02 17:27:25+00:00,iPhone,This is Django. He accidentally opened the front facing camera. Did him quite the frighten. 12/10 https://t.co/kQVQoOW9NZ,12,10,Django,False,https://pbs.twimg.com/media/CysBn-lWIAAoRx1.jpg,1,15326,4480,Tibetan Mastiff
409,803773340896923648,2016-11-30 01:31:12+00:00,iPhone,This is Diogi. He fell in the pool as soon as he was brought home. Clumsy puppo. 12/10 would pet until dry https://t.co/ZxeRjMKaWt,12,10,Diogi,True,https://pbs.twimg.com/media/CyeTku-XcAALkBd.jpg,2,11203,3220,Miniature Pinscher
410,803638050916102144,2016-11-29 16:33:36+00:00,iPhone,Pupper hath acquire enemy. 13/10 https://t.co/ns9qoElfsX,13,10,,True,https://pbs.twimg.com/ext_tw_video_thumb/803638023904559104/pu/img/vxm0Htm5iIV7EOAQ.jpg,1,12270,4828,Labrador Retriever
412,803276597545603072,2016-11-28 16:37:19+00:00,iPhone,This is Winston. His selfie game is legendary. Will steal your girl with a single snap. 11/10 handsome as h*ck https://t.co/jxQhxoPsgL,11,10,Winston,False,https://pbs.twimg.com/media/CyXPzXRWgAAvd1j.jpg,1,11207,2887,Pembroke
413,802952499103731712,2016-11-27 19:09:28+00:00,iPhone,This is Marley. She's having a ruff day. Pretty pupset. 12/10 would assist https://t.co/yLm7hQ6UXh,12,10,Marley,False,https://pbs.twimg.com/media/CySpCSHXcAAN-qC.jpg,1,10085,2336,Chow
414,802572683846291456,2016-11-26 18:00:13+00:00,iPhone,This is Winnie. She's h*ckin ferocious. Dandelion doesn't even see her coming. 12/10 would pet with caution https://t.co/EFfLCP7oQv,12,10,Winnie,False,https://pbs.twimg.com/media/CyNPmJgXcAECPuB.jpg,1,9959,2926,Golden Retriever
416,802239329049477120,2016-11-25 19:55:35+00:00,iPhone,This is Loki. He'll do your taxes for you. Can also make room in your budget for all the things you bought today. 12/10 what a puppo https://t.co/5oWrHCWg87,12,10,Loki,True,https://pbs.twimg.com/media/CyIgaTEVEAA-9zS.jpg,2,10132,3040,Eskimo Dog
417,801958328846974976,2016-11-25 01:18:59+00:00,iPhone,This is Ronnie. He hopes you're having a great day. Nifty tongue slip. 12/10 would pat head approvingly https://t.co/4fY2bsAm65,12,10,Ronnie,False,https://pbs.twimg.com/media/CyEg2AXUsAA1Qpf.jpg,1,8608,1992,Staffordshire Bullterrier
418,801538201127157760,2016-11-23 21:29:33+00:00,iPhone,This is Wallace. He'll be your chau-fur this evening. 12/10 eyes on the road Wallace https://t.co/p1RD39XjUe,12,10,Wallace,False,https://pbs.twimg.com/media/Cx-itFWWIAAZu7l.jpg,1,9141,2391,Pembroke
420,801167903437357056,2016-11-22 20:58:07+00:00,iPhone,This is Milo. I would do terrible things for Milo. 13/10 https://t.co/R6wJyC2Tey,13,10,Milo,False,https://pbs.twimg.com/media/Cx5R8wPVEAALa9r.jpg,1,27386,6961,Cocker Spaniel
421,801115127852503040,2016-11-22 17:28:25+00:00,iPhone,This is Bones. He's being haunted by another doggo of roughly the same size. 12/10 deep breaths pupper everything's fine https://t.co/55Dqe0SJNj,12,10,Bones,True,https://pbs.twimg.com/media/Cx4h7zHUsAAqaJd.jpg,1,8992,2429,Dalmatian
422,800751577355128832,2016-11-21 17:23:47+00:00,iPhone,Say hello to Mauve and Murphy. They're rather h*ckin filthy. Preferred nap over bath. Both 12/10 https://t.co/4UwCTW3lXG,12,10,Mauve,False,https://pbs.twimg.com/media/CxzXOyBW8AEu_Oi.jpg,2,11701,3214,Cocker Spaniel
423,800513324630806528,2016-11-21 01:37:04+00:00,iPhone,This is Chef. Chef loves everyone and wants everyone to love each other. 11/10 https://t.co/ILHGs0e6Dm,11,10,Chef,False,https://pbs.twimg.com/media/Cxv-nkJUoAAhzMt.jpg,1,14685,3495,Pembroke
425,800388270626521089,2016-11-20 17:20:08+00:00,iPhone,This is Doc. He takes time out of every day to worship our plant overlords. 12/10 quite the floofer https://t.co/azMneS6Ly5,12,10,Doc,True,https://pbs.twimg.com/media/CxuM3oZW8AEhO5z.jpg,2,12456,3265,Golden Retriever
426,800141422401830912,2016-11-20 00:59:15+00:00,iPhone,This is Peaches. She's the ultimate selfie sidekick. Super sneaky tongue slip appreciated. 13/10 https://t.co/pbKOesr8Tg,13,10,Peaches,False,https://pbs.twimg.com/media/CxqsX-8XUAAEvjD.jpg,3,17092,2980,Golden Retriever
428,799757965289017345,2016-11-18 23:35:32+00:00,iPhone,This is Sobe. She's a h*ckin happy doggo. Only one leg tho. Must have good balance. 13/10 would smile back https://t.co/OiH8PaOxB1,13,10,Sobe,True,https://pbs.twimg.com/media/CxlPnoSUcAEXf1i.jpg,1,9390,2506,Border Collie
429,799422933579902976,2016-11-18 01:24:14+00:00,iPhone,This is Longfellow (prolly sophisticated). He's a North Appalachian Oatzenjammer. Concerned about wrinkled feets. 12/10 would hug softly https://t.co/bpLuQuxzHZ,12,10,Longfellow,False,https://pbs.twimg.com/media/Cxge6AdUQAAvXLB.jpg,1,8965,2213,Miniature Pinscher
430,799297110730567681,2016-11-17 17:04:16+00:00,iPhone,This is Jeffrey. He's quite the jokester. Takes it too far sometimes. Still 11/10 would pet https://t.co/YDtZcAiMAf,11,10,Jeffrey,False,https://pbs.twimg.com/media/CxeseRgUoAM_SQK.jpg,1,11065,3227,Malamute
431,799063482566066176,2016-11-17 01:35:54+00:00,iPhone,This is Mister. He only wears the most fashionable af headwear. 11/10 h*ckin stylish https://t.co/BXJFKOVnJm,11,10,Mister,False,https://pbs.twimg.com/media/CxbX_n2WIAAHaLS.jpg,2,9058,2863,Norfolk Terrier
432,798933969379225600,2016-11-16 17:01:16+00:00,iPhone,This is Iroh. He's in a predicament. 12/10 someone help him https://t.co/KJAKO2kXsL,12,10,Iroh,False,https://pbs.twimg.com/media/CxZiLcLXUAApMVy.jpg,1,14712,5203,Siberian Husky
433,798925684722855936,2016-11-16 16:28:21+00:00,iPhone,This is Shadow. He's a firm believer that they're all good dogs. H*ckin passionate about it too. 11/10 I stand with Shadow https://t.co/8yvpacwBcu,11,10,Shadow,False,https://pbs.twimg.com/media/CxZaqh_WQAA7lY3.jpg,1,8246,1663,West Highland White Terrier
434,798209839306514432,2016-11-14 17:03:50+00:00,iPhone,This is Cooper. His bow tie was too heavy for the front so he moved it to the side. Balanced af now. 13/10 https://t.co/jG1PAFkB81,13,10,Cooper,False,https://pbs.twimg.com/media/CxPPnCYWIAAo_ao.jpg,1,11548,2954,Pekinese
435,797971864723324932,2016-11-14 01:18:12+00:00,iPhone,Here's a helicopter pupper. He takes off at random. H*ckin hard to control. 12/10 rare af https://t.co/GRWPgNKt2z,12,10,,True,https://pbs.twimg.com/media/CxL3IWeVEAAAIE2.jpg,1,13018,3652,American Staffordshire Terrier
436,797545162159308800,2016-11-12 21:02:38+00:00,iPhone,This is Cassie. She steals things. Guilt increases slightly each time. 12/10 would forgive almost immediately https://t.co/Ia19irLwyB,12,10,Cassie,False,https://pbs.twimg.com/media/CxFzFAAUAAA5C9z.jpg,1,16198,5656,Pembroke
437,797236660651966464,2016-11-12 00:36:46+00:00,iPhone,This is Pancake. She loves Batman and winks like a h*ckin champ. 12/10 real crowd pleaser https://t.co/6kqsAjJNhi,12,10,Pancake,False,https://pbs.twimg.com/media/CxBafisWQAAtJ1X.jpg,2,22328,7726,Collie
438,796865951799083009,2016-11-11 00:03:42+00:00,iPhone,This is Tyr. He's just checking on you. Nifty af tongue slip. 12/10 would absolutely pet https://t.co/Jgnuiyvq06,12,10,Tyr,False,https://pbs.twimg.com/media/Cw8JWZ2UsAAJOZ6.jpg,1,8564,2198,Cardigan
439,796759840936919040,2016-11-10 17:02:03+00:00,iPhone,Say hello to Romeo. He was just told that it's too cold for the pool. H*ckin nonsense. 11/10 would help fill up https://t.co/6hx7ur6sNI,11,10,Romeo,False,https://pbs.twimg.com/media/Cw6o1JQXcAAtP78.jpg,1,13256,3562,American Staffordshire Terrier
440,796484825502875648,2016-11-09 22:49:15+00:00,iPhone,Here's a sleepy doggo that requested some assistance. 12/10 would carry everywhere https://t.co/bvkkqOjNDV,12,10,,True,https://pbs.twimg.com/media/Cw2uty8VQAAB0pL.jpg,1,8472,2042,Cocker Spaniel
441,796387464403357696,2016-11-09 16:22:22+00:00,iPhone,This is Snicku. He's having trouble reading because he's a dog. Glasses only helped a little. Nap preferred. 12/10 would snug well https://t.co/cVLUasbKA5,12,10,Snicku,False,https://pbs.twimg.com/media/Cw1WKu1UQAAvWsu.jpg,1,12334,4861,Pekinese
442,796149749086875649,2016-11-09 00:37:46+00:00,iPhone,This is Ruby. She just turned on the news. Officially terrified. 11/10 deep breaths Ruby https://t.co/y5KarNXWXt,11,10,Ruby,False,https://pbs.twimg.com/media/Cwx99rpW8AMk_Ie.jpg,1,36177,16628,Golden Retriever
443,796116448414461957,2016-11-08 22:25:27+00:00,iPhone,I didn't believe it at first but now I can see that voter fraud is a serious h*ckin issue. 11/10 https://t.co/7i0bDMbrVN,11,10,,False,https://pbs.twimg.com/media/CwxfrguUUAA1cbl.jpg,1,10139,2813,Cardigan
444,796080075804475393,2016-11-08 20:00:55+00:00,iPhone,This is Yogi. He's 98% floof. Snuggable af. 12/10 https://t.co/opoXKxmfFm,12,10,Yogi,False,https://pbs.twimg.com/media/Cww-msrXcAAxm3K.jpg,1,9469,2703,Chow
445,796031486298386433,2016-11-08 16:47:50+00:00,iPhone,This is Daisy. She's here to make your day better. 13/10 mission h*ckin successful https://t.co/PbgvuD0qIL,13,10,Daisy,False,https://pbs.twimg.com/media/CwwSaWJWIAASuoY.jpg,1,12071,4284,Golden Retriever
446,795464331001561088,2016-11-07 03:14:10+00:00,iPhone,Elder doggo does a splash. Both 13/10 incredible stuff https://t.co/gBUDjdEcqz,13,10,,True,https://pbs.twimg.com/ext_tw_video_thumb/795464066940764160/pu/img/jPkMMQXdydb7CqFX.jpg,1,55683,27728,Golden Retriever
447,795400264262053889,2016-11-06 22:59:35+00:00,iPhone,This is Brody. He's trying to make the same face as the football. 12/10 https://t.co/2H4MfOGlpQ,12,10,Brody,False,https://pbs.twimg.com/media/CwnUUGTWIAE8sFR.jpg,2,11270,3323,Golden Retriever
449,794926597468000259,2016-11-05 15:37:24+00:00,iPhone,This is Mack. He's rather h*ckin sleepy. Exceptional ears. 12/10 would boop https://t.co/XRPvTPF0VH,12,10,Mack,False,https://pbs.twimg.com/media/CwglhZVXgAAc3_w.jpg,1,11492,2697,Toy Poodle
450,794332329137291264,2016-11-04 00:15:59+00:00,iPhone,This is Nimbus (like the cloud). He just bought this fancy af duck raincoat. Only protects one ear tho. 12/10 so h*ckin floofy https://t.co/SIQbb8c3AU,12,10,Nimbus,False,https://pbs.twimg.com/media/CwYJBiHXgAQlvrh.jpg,1,10686,3088,Samoyed
452,793962221541933056,2016-11-02 23:45:19+00:00,iPhone,This is Maximus. His face is stuck like that. Tragic really. Great tongue tho. 12/10 would pet firmly https://t.co/xIfrsMNLBR,12,10,Maximus,False,https://pbs.twimg.com/media/CwS4aqZXUAAe3IO.jpg,1,18910,5711,Labrador Retriever
453,793845145112371200,2016-11-02 16:00:06+00:00,iPhone,This is Clark. He was just caught wearing pants. 13/10 game-changing af https://t.co/2Xo19aPrG5,13,10,Clark,False,https://pbs.twimg.com/media/CwRN8H6WgAASe4X.jpg,1,10295,2187,Old English Sheepdog
454,793601777308463104,2016-11-01 23:53:02+00:00,iPhone,This is Dobby. I can't stop looking at her feet. 12/10 would absolutely snug https://t.co/LhzPWv6rTv,12,10,Dobby,False,https://pbs.twimg.com/media/CwNwmxvXEAEJ54Z.jpg,1,8926,1908,Miniature Pinscher
455,793500921481273345,2016-11-01 17:12:16+00:00,iPhone,This is Fiona. She's an extremely mediocre copilot. Very distracting. Wink makes up for all the missed turns. 12/10 https://t.co/aF5MmpvPqN,12,10,Fiona,False,https://pbs.twimg.com/media/CwMU34YWIAAz1nU.jpg,2,11953,2786,Golden Retriever
456,793286476301799424,2016-11-01 03:00:09+00:00,iPhone,This is Moreton. He's the Good Boy Who Lived. 13/10 magical as h*ck https://t.co/rLHGx3VAF3,13,10,Moreton,False,https://pbs.twimg.com/media/CwJR1okWIAA6XMp.jpg,1,27597,10723,Afghan Hound
457,793271401113350145,2016-11-01 02:00:14+00:00,iPhone,Meet Dave. It's his favorite day of the year. He gets to fulfill his dream of being a dinosaur. 12/10 inspirational af https://t.co/MgQSdfZGPN,12,10,Dave,False,https://pbs.twimg.com/media/CwJEIKTWYAAvL-T.jpg,1,9677,2763,Siberian Husky
458,793256262322548741,2016-11-01 01:00:05+00:00,iPhone,Oh h*ck look at this spookling right here. Fright level off the charts. 12/10 sufficiently spooked https://t.co/BNy9IIJMb0,12,10,,False,https://pbs.twimg.com/media/CwI2XCvXEAEO8mc.jpg,1,22350,9714,Basset
459,793241302385262592,2016-11-01 00:00:38+00:00,iPhone,This is Tucker. He's out here bustin h*ckin ghosts. 13/10 dedicated af https://t.co/Ap477GhwXt,13,10,Tucker,False,https://pbs.twimg.com/media/CwIougTWcAAMLyq.jpg,1,11780,3812,Golden Retriever
460,793226087023144960,2016-10-31 23:00:11+00:00,iPhone,"This is Juno. She spooked me up real good, but only to get my attention. Above average handwriting for a dog I think. 11/10 https://t.co/hFxxBCWlwj",11,10,Juno,False,https://pbs.twimg.com/media/CwIa5CjW8AErZgL.jpg,1,11001,3338,Wire-Haired Fox Terrier
461,793210959003287553,2016-10-31 22:00:04+00:00,iPhone,This is Maude. She's the h*ckin happiest wasp you've ever seen. 10/10 would pet with caution https://t.co/etL8FHBrh8,10,10,Maude,False,https://pbs.twimg.com/media/CwINKJeW8AYHVkn.jpg,1,9997,3301,French Bulldog
462,793195938047070209,2016-10-31 21:00:23+00:00,iPhone,Say hello to Lily. She's pupset that her costume doesn't fit as well as last year. 12/10 poor puppo https://t.co/YSi6K1firY,12,10,Lily,True,https://pbs.twimg.com/media/CwH_foYWgAEvTyI.jpg,2,17063,6547,Labrador Retriever
463,793180763617361921,2016-10-31 20:00:05+00:00,iPhone,This is Newt. He's a strawberry. 11/10 https://t.co/2VhmlwxA1Q,11,10,Newt,False,https://pbs.twimg.com/media/CwHxsdYVMAAqGCJ.jpg,1,7740,2310,Lakeland Terrier
464,793165685325201412,2016-10-31 19:00:10+00:00,iPhone,This is Benji. He's Air Bud. It's a low effort costume but he pulls it off rather h*ckin well. 12/10 would happily get dunked on https://t.co/IbzT7DJvBo,12,10,Benji,False,https://pbs.twimg.com/media/CwHj-jGWAAAnsny.jpg,1,10478,3238,Golden Retriever
465,793150605191548928,2016-10-31 18:00:14+00:00,iPhone,This is Nida. She's a free elf. Waited so long for this day. 11/10 https://t.co/3lE8Izgmkf,11,10,Nida,False,https://pbs.twimg.com/media/CwHWOZ7W8AAHv8S.jpg,1,6909,1984,Italian Greyhound
467,793120401413079041,2016-10-31 16:00:13+00:00,iPhone,"This is Robin. She's desperately trying to do me a frighten, but her tongue drastically decreases her spook value. Still 11/10 great effort https://t.co/sxMrsOZ8zb",11,10,Robin,False,https://pbs.twimg.com/media/CwG6zDfWcAA8jBD.jpg,1,14202,4551,Labrador Retriever
469,792883833364439040,2016-10-31 00:20:11+00:00,iPhone,This is Bailey. She's rather h*ckin hype for Halloween tomorrow. Carved those pupkins herself. 12/10 https://t.co/v17mFm0Ftz,12,10,Bailey,False,https://pbs.twimg.com/media/CwDjoH3WAAIniIs.jpg,3,12666,4964,Standard Poodle
470,792773781206999040,2016-10-30 17:02:53+00:00,iPhone,This is Monster. Not an actual monster tho. He's showing you his tongue. Very impressive Monster. 12/10 would snug https://t.co/RhaPExuxJL,12,10,Monster,False,https://pbs.twimg.com/media/CwB_i-zXEAEiP29.jpg,1,8209,1963,Yorkshire Terrier
471,792394556390137856,2016-10-29 15:55:58+00:00,iPhone,Meet BeBe. She rocks the messy bun of your dreams. H*ckin flawless. 12/10 would watch her tutorial https://t.co/of0pFNBIl8,12,10,BeBe,False,https://pbs.twimg.com/media/Cv8moW9W8AIHOxR.jpg,2,15128,4998,Cocker Spaniel
472,792050063153438720,2016-10-28 17:07:05+00:00,iPhone,This is Remus. He's a mop that came to life. Can't see anything. Constantly trips over himself. Still a very good dog. 11/10 https://t.co/S3f1SYylzu,11,10,Remus,False,https://pbs.twimg.com/media/Cv3tU38WcAASFas.jpg,2,8029,2088,Komondor
473,791672322847637504,2016-10-27 16:06:04+00:00,iPhone,When she says you're a good boy and you know you're a good boy because you're a good boy. 13/10 https://t.co/O5IUmRHRIh,13,10,,False,https://pbs.twimg.com/media/CvyVxQRWEAAdSZS.jpg,1,13129,3661,Golden Retriever
474,791406955684368384,2016-10-26 22:31:36+00:00,iPhone,Say hello to Levi. He's a Madagascan Butterbop. One of the more docile Butterbops I've seen. 12/10 would give all the pets https://t.co/Zcw9Sccctc,12,10,Levi,False,https://pbs.twimg.com/media/CvukbEkWAAAV-69.jpg,4,14670,4797,Pembroke
475,791312159183634433,2016-10-26 16:14:55+00:00,iPhone,This is Mabel. She's super h*ckin smol. Portable af. Comes with the smol shoe. 12/10 would keep in frocket https://t.co/GGJvxYt3xK,12,10,Mabel,False,https://pbs.twimg.com/media/CvtONV4WAAAQ3Rn.jpg,4,9841,2963,Miniature Pinscher
476,790987426131050500,2016-10-25 18:44:32+00:00,iPhone,This is Misty. She has a cowboy hat on her nose. 12/10 https://t.co/Eno0mypHIr,12,10,Misty,False,https://pbs.twimg.com/media/Cvom3ZJXEAE29TD.jpg,1,11089,2483,Cocker Spaniel
477,790946055508652032,2016-10-25 16:00:09+00:00,iPhone,This is Betty. She's assisting with the dishes. Such a good puppo. 12/10 h*ckin helpful af https://t.co/dgvTPZ9tgI,12,10,Betty,True,https://pbs.twimg.com/media/CvoBPWRWgAA4het.jpg,1,18601,5496,Golden Retriever
478,790698755171364864,2016-10-24 23:37:28+00:00,iPhone,This is Mosby. He appears to be rather h*ckin snuggable af. 12/10 keep it up Mosby https://t.co/IiiBq460I7,12,10,Mosby,False,https://pbs.twimg.com/media/CvkgUjbUsAEvo7l.jpg,1,9158,2203,Bernese Mountain Dog
479,790581949425475584,2016-10-24 15:53:19+00:00,iPhone,This is Duke. He sneaks into the fridge sometimes. It's his safe place. 11/10 would give little jacket if necessary https://t.co/Fd5WFDTMH4,11,10,Duke,False,https://pbs.twimg.com/media/Cvi2FiKWgAAif1u.jpg,2,22473,8183,Malinois
480,790337589677002753,2016-10-23 23:42:19+00:00,iPhone,Meet Maggie. She can hear your cells divide. 12/10 can also probably fly https://t.co/ovE2hqXryV,12,10,Maggie,False,https://pbs.twimg.com/media/CvfX2AnWYAAQTay.jpg,1,8740,2167,Pembroke
481,790277117346975746,2016-10-23 19:42:02+00:00,iPhone,This is Bruce. He never backs down from a challenge. 11/10 you got this Bruce https://t.co/aI7umZHIq7,11,10,Bruce,False,https://pbs.twimg.com/media/Cveg1-NXgAASaaT.jpg,1,14081,3732,Labrador Retriever
482,789986466051088384,2016-10-23 00:27:05+00:00,iPhone,This is Happy. He's a bathtub reviewer. Seems to be pleased with this one. 12/10 https://t.co/Ln89R4FP7v,12,10,Happy,False,https://pbs.twimg.com/media/CvaYgDOWgAEfjls.jpg,1,10369,2704,Golden Retriever
483,789628658055020548,2016-10-22 00:45:17+00:00,iPhone,This is Eli. He can fly. 13/10 magical af https://t.co/huPSJJ7FDI,13,10,Eli,False,https://pbs.twimg.com/media/CvVTEnPXYAAWLyL.jpg,1,8448,2080,Chow
484,789599242079838210,2016-10-21 22:48:24+00:00,iPhone,This is Brownie. She's wearing a Halloween themed onesie. 12/10 festive af https://t.co/0R4meWXFOx,12,10,Brownie,False,https://pbs.twimg.com/media/CvU4UZpXgAE1pAV.jpg,2,7620,2279,Chesapeake Bay Retriever
485,789530877013393408,2016-10-21 18:16:44+00:00,iPhone,This is Rizzy. She smiles a lot. 12/10 contagious af https://t.co/TU4sZogVIq,12,10,Rizzy,False,https://pbs.twimg.com/media/CvT6IV6WEAQhhV5.jpg,3,13188,3942,Schipperke
486,789268448748703744,2016-10-21 00:53:56+00:00,iPhone,This is Stella. She's happier than I will ever be. 10/10 would trade lives with https://t.co/JSs2bfDtTS,10,10,Stella,False,https://pbs.twimg.com/media/CvQLdotWcAAZn86.jpg,1,10196,3014,Malamute
487,789137962068021249,2016-10-20 16:15:26+00:00,iPhone,This is Bo. He's a West Congolese Bugaboop Snuggle. Rather exotic. Master of the head tilt. 12/10 would pay to pet https://t.co/2jwxxtNzoN,12,10,Bo,False,https://pbs.twimg.com/media/CvOUw8vWYAAzJDq.jpg,2,10875,3244,Chihuahua
488,788908386943430656,2016-10-20 01:03:11+00:00,iPhone,"This is Lucy. She destroyed not one, but two remotes trying to turn off the debate. 11/10 relatable af https://t.co/3BXh073tDm",11,10,Lucy,False,https://pbs.twimg.com/media/CvLD-mbWYAAFI8w.jpg,1,30653,14409,Golden Retriever
489,788765914992902144,2016-10-19 15:37:03+00:00,iPhone,This is Butter. She can have whatever she wants forever. 12/10 would hug softly https://t.co/x5gXRS1abq,12,10,Butter,False,https://pbs.twimg.com/media/CvJCabcWgAIoUxW.jpg,1,30658,12014,Cocker Spaniel
490,788412144018661376,2016-10-18 16:11:17+00:00,iPhone,This is Dexter. He breaks hearts for a living. 11/10 h*ckin handsome af https://t.co/4DhSsC1W7S,11,10,Dexter,False,https://pbs.twimg.com/media/CvEAqQoWgAADj5K.jpg,1,16060,5990,Golden Retriever
491,788178268662984705,2016-10-18 00:41:57+00:00,iPhone,Atlas is back and this time he's got doggles. Still 13/10 solarly conscious af https://t.co/s7MgFWDySc,13,10,,False,https://pbs.twimg.com/media/CvAr88kW8AEKNAO.jpg,2,8100,2488,Samoyed
492,788150585577050112,2016-10-17 22:51:57+00:00,iPhone,This is Leo. He's a golden chow. Rather h*ckin rare. 13/10 would give extra pats https://t.co/xosHjFzVXc,13,10,Leo,False,https://pbs.twimg.com/media/CvASw6dWcAQmo3X.jpg,3,6865,1510,Chow
494,787810552592695296,2016-10-17 00:20:47+00:00,iPhone,This is Frank. He wears sunglasses and walks himself. 11/10 I'll never be this cool or independent https://t.co/pNNjBtHWPc,11,10,Frank,False,https://pbs.twimg.com/media/Cu7dg2RXYAIaGXE.jpg,2,9717,3540,Pug
495,787717603741622272,2016-10-16 18:11:26+00:00,iPhone,This is Tonks. She is a service puppo. Can hear a caterpillar hiccup from 7 miles away. 13/10 would follow anywhere https://t.co/i622ZbWkUp,13,10,Tonks,True,https://pbs.twimg.com/media/Cu6I9vvWIAAZG0a.jpg,3,11416,3240,German Shepherd
496,787397959788929025,2016-10-15 21:01:17+00:00,iPhone,This is Moose. He's rather h*ckin dangerous (you can tell by the collar). 11/10 would still attempt to snug https://t.co/lHVHGdDzb3,11,10,Moose,False,https://pbs.twimg.com/media/Cu1mQsDWEAAU_VQ.jpg,1,12120,3300,Chihuahua
