,tweet_id,timestamp,source,text,rating_numerator,rating_denominator,name,nickname,jpg_url,img_num,favorites,retweets,dog_label
823,735648611367784448,2016-05-26 01:47:51+00:00,iPhone,*faints* 12/10 perfection in pupper form https://t.co/t6TxTwTLEK,12,10,,True,https://pbs.twimg.com/media/CjWMezdW0AErwU3.jpg,1,4397,1237,Pembroke
824,735635087207878657,2016-05-26 00:54:06+00:00,iPhone,This is Dakota. He hasn't grow into his skin yet. 11/10 would squeeze softly https://t.co/IvFSlNXpgj,11,10,Dakota,False,https://pbs.twimg.com/media/CjWANBlVAAAaN-a.jpg,1,6776,2659,Pug
826,735256018284875776,2016-05-24 23:47:49+00:00,iPhone,This is Kellogg. He accidentally opened the front facing camera. 8/10 get it together doggo https://t.co/MRYv7nDPyS,8,10,Kellogg,True,https://pbs.twimg.com/media/CjQnclkVEAA4pnK.jpg,1,3675,993,Staffordshire Bullterrier
827,735137028879360001,2016-05-24 15:55:00+00:00,iPhone,Meet Buckley. His family &amp; some neighbors came over to watch him perform but he's nervous af. 9/10 u got this pupper https://t.co/5bdCpPlno9,9,10,Buckley,True,https://pbs.twimg.com/media/CjO7OfeWgAAUQy-.jpg,1,3428,1092,Walker Hound
828,734912297295085568,2016-05-24 01:02:00+00:00,iPhone,This is Jax. He's a literal fluffball. Sneaky tongue slip. 10/10 would pet nonstop https://t.co/9MGouPwQmK,10,10,Jax,False,https://pbs.twimg.com/media/CjLuzPvUoAAbU5k.jpg,1,2993,572,Maltese Dog
829,734787690684657664,2016-05-23 16:46:51+00:00,iPhone,This dog is more successful than I will ever be. 13/10 absolute legend https://t.co/BPoaHySYwA,13,10,,False,https://pbs.twimg.com/media/CjJ9gQ1WgAAXQtJ.jpg,4,13745,7102,Golden Retriever
830,734776360183431168,2016-05-23 16:01:50+00:00,iPhone,This is Livvie. Someone should tell her it's been 47 years since Woodstock. Magical eyes tho 11/10 would stare into https://t.co/qw07vhVHuO,11,10,Livvie,False,https://pbs.twimg.com/media/CjJzMlBUoAADMLx.jpg,1,2742,608,Siberian Husky
831,733828123016450049,2016-05-21 01:13:53+00:00,iPhone,This is Terry. The harder you hug him the farther his tongue sticks out. 10/10 magical af https://t.co/RFToQQI8fJ,10,10,Terry,False,https://pbs.twimg.com/media/Ci8UxxcW0AYgHDh.jpg,2,3926,881,Beagle
832,733822306246479872,2016-05-21 00:50:46+00:00,iPhone,This is Moose. He's a Polynesian Floofer. Dapper af. 10/10 would pet diligently https://t.co/mVfqRdppTL,10,10,Moose,True,https://pbs.twimg.com/media/Ci8Pfg_UUAA2m9i.jpg,1,4015,1141,Lhasa
833,733482008106668032,2016-05-20 02:18:32+00:00,iPhone,"""Ello this is dog how may I assist"" ...10/10 https://t.co/jeAENpjH7L",10,10,,False,https://pbs.twimg.com/media/Ci3Z_idUkAA8RUh.jpg,1,3438,1065,French Bulldog
834,733460102733135873,2016-05-20 00:51:30+00:00,iPhone,This is Hermione. Her face is as old as time. Appears fluffy af tho. 11/10 pretty damn majestic https://t.co/0b41Q4DKCA,11,10,Hermione,False,https://pbs.twimg.com/media/Ci3GDeyUoAAKOxn.jpg,1,4605,1451,Chow
835,733109485275860992,2016-05-19 01:38:16+00:00,iPhone,"Like father (doggo), like son (pupper). Both 12/10 https://t.co/pG2inLaOda",12,10,,True,https://pbs.twimg.com/media/CiyHLocU4AI2pJu.jpg,1,44619,17621,Golden Retriever
836,732732193018155009,2016-05-18 00:39:02+00:00,iPhone,This is Ralpher. He's an East Guinean Flop Dog. Cuddly af. 12/10 https://t.co/rVOLuNRpjH,12,10,Ralpher,False,https://pbs.twimg.com/media/CiswCQhWYAI5-QW.jpg,1,2671,599,Staffordshire Bullterrier
837,732726085725589504,2016-05-18 00:14:46+00:00,iPhone,This is Aldrick. He looks wise af. Also exceptionally fluffy. Only two legs tho (unfortunate). 11/10 would still hug https://t.co/QwiCVLPMNL,11,10,Aldrick,False,https://pbs.twimg.com/media/CisqdVcXEAE3iW7.jpg,1,3855,1003,Pomeranian
838,732585889486888962,2016-05-17 14:57:41+00:00,iPhone,"When your teacher agreed on 10,000 RTs and no final but after 24 hours you only have 37... 10/10 https://t.co/sVnJfWVjUp",10,10,,False,https://pbs.twimg.com/media/Ciqq-VFUUAANlWm.jpg,2,4016,868,Staffordshire Bullterrier
839,732375214819057664,2016-05-17 01:00:32+00:00,iPhone,This is Kyle (pronounced 'Mitch'). He strives to be the best doggo he can be. 11/10 would pat on head approvingly https://t.co/aA2GiTGvlE,11,10,Kyle,True,https://pbs.twimg.com/media/CinrX2EWkAABDYt.jpg,1,8832,2838,Basset
840,732005617171337216,2016-05-16 00:31:53+00:00,iPhone,This is Larry. He has no self control. Tongue still nifty af tho 11/10 https://t.co/ghyT4Ubk1r,11,10,Larry,False,https://pbs.twimg.com/media/CiibOMzUYAA9Mxz.jpg,1,16324,6154,English Setter
841,731285275100512256,2016-05-14 00:49:30+00:00,iPhone,This is Solomon. He's a Beneroo Cumberflop. 12/10 would hug passionately https://t.co/5phLAnGPTP,12,10,Solomon,False,https://pbs.twimg.com/media/CiYME3tVAAENz99.jpg,1,3798,1090,Pembroke
843,730924654643314689,2016-05-13 00:56:32+00:00,iPhone,We only rate dogs. Pls stop sending non-canines like this Bulgarian Eyeless Porch Bear. This is unacceptable... 9/10 https://t.co/2yctWAUZ3Z,9,10,,False,https://pbs.twimg.com/media/CiTEFjDXAAAqU6I.jpg,1,6682,2234,Newfoundland
844,730573383004487680,2016-05-12 01:40:42+00:00,iPhone,This is Rooney. He can't comprehend glass. 10/10 it'll be ok pupper https://t.co/CnUl2uDBBV,10,10,Rooney,True,https://pbs.twimg.com/media/CiOEnI6WgAAmq4E.jpg,2,5407,2435,American Staffordshire Terrier
845,730427201120833536,2016-05-11 15:59:50+00:00,iPhone,This is Crystal. She's flawless. Really wants to be a frat bro. 11/10 who does she even know here? https://t.co/WyqNFvEulG,11,10,Crystal,False,https://pbs.twimg.com/media/CiL_qh0W0AAu5VA.jpg,1,3809,1176,Eskimo Dog
846,730211855403241472,2016-05-11 01:44:07+00:00,iPhone,This is Ziva. She doesn't know how her collar works. 11/10 would totally fix for her https://t.co/K7pthJXjWE,11,10,Ziva,False,https://pbs.twimg.com/media/CiI7zVZUoAEzGW7.jpg,1,4180,1182,Pug
849,729823566028484608,2016-05-10 00:01:12+00:00,iPhone,This is Stefan. He's a downright remarkable pup. 13/10 https://t.co/Ebjt6Y4fMh,13,10,Stefan,False,https://pbs.twimg.com/media/CiDap8fWEAAC4iW.jpg,1,4358,1390,Kelpie
850,729463711119904772,2016-05-09 00:11:16+00:00,iPhone,Meet Pupcasso. You can't afford his art. 13/10 talented af https://t.co/f2VUpy4WO0,13,10,Pupcasso,False,https://pbs.twimg.com/media/Ch-TXpFXAAAwPGf.jpg,1,6340,2586,German Shepherd
852,728986383096946689,2016-05-07 16:34:32+00:00,iPhone,"This is Puff. He started out on the streets (first pic), but don't let the new smile fool you, still tough af. 11/10 https://t.co/kiuXRXcg4B",11,10,Puff,False,https://pbs.twimg.com/media/Ch3hOGWUYAE7w0y.jpg,2,3460,917,Maltese Dog
853,728760639972315136,2016-05-07 01:37:30+00:00,iPhone,"When you're way too slow for the ""down low"" portion of a high five. 13/10 https://t.co/Cofwoy7Vpq",13,10,,False,https://pbs.twimg.com/media/Ch0T71OWMAA4yIw.jpg,1,5090,1911,Pembroke
854,728751179681943552,2016-05-07 00:59:55+00:00,iPhone,This is Flurpson. He can't believe it's not butter. 10/10 https://t.co/XD3ort1PsE,10,10,Flurpson,False,https://pbs.twimg.com/media/Ch0LVPdW0AEdHgU.jpg,1,3032,757,Saint Bernard
856,728409960103686147,2016-05-06 02:24:02+00:00,iPhone,This is Wallace. He's a skater pup. He said see ya later pup. Can easily do a kick flip. Gnarly af. 10/10 v petable https://t.co/5i8fORVKgr,10,10,Wallace,False,https://pbs.twimg.com/media/ChvU_DwWMAArx5L.jpg,1,5383,2269,Saint Bernard
857,728387165835677696,2016-05-06 00:53:27+00:00,iPhone,"This is Enchilada (yes, that's her real name). She's a Low-Cruisin Plopflopple. Very rare. Only a few left. 12/10 https://t.co/SiaiTWgsfP",12,10,Enchilada,False,https://pbs.twimg.com/media/ChvAQuMWMAAVaKD.jpg,1,3999,1075,Collie
858,728046963732717569,2016-05-05 02:21:37+00:00,iPhone,This is Raymond. He controls fountains with his tongue. 11/10 pretty damn magical https://t.co/9aMxSbOaAZ,11,10,Raymond,False,https://pbs.twimg.com/media/ChqK2cVWMAAE5Zj.jpg,1,4722,1328,Newfoundland
859,728035342121635841,2016-05-05 01:35:26+00:00,iPhone,This is all I want in my life. 12/10 for super sleepy pupper https://t.co/4RlLA5ObMh,12,10,,True,https://pbs.twimg.com/media/ChqARqmWsAEI6fB.jpg,1,4953,1872,Pomeranian
860,728015554473250816,2016-05-05 00:16:48+00:00,iPhone,This is Rueben. He has reached ultimate pupper zen state. 11/10 tranquil af https://t.co/Z167HgtnBi,11,10,Rueben,True,https://pbs.twimg.com/media/ChpuRyvVAAARMoq.jpg,1,4479,1219,Cocker Spaniel
861,727685679342333952,2016-05-04 02:26:00+00:00,iPhone,This is Cilantro. She's a Fellation Gadzooks. Eyes are super magical af. 12/10 could get lost in https://t.co/yJ26LNuyj5,12,10,Cilantro,False,https://pbs.twimg.com/media/ChlCQg-VIAQ_8g4.jpg,1,3206,720,Border Collie
862,727644517743104000,2016-05-03 23:42:26+00:00,iPhone,Here's a doggo struggling to cope with the winds. 13/10 https://t.co/qv3aUwaouT,13,10,,True,https://pbs.twimg.com/media/Chkc1BQUoAAa96R.jpg,2,6431,1962,Great Pyrenees
863,727524757080539137,2016-05-03 15:46:33+00:00,iPhone,This pupper had to undergo emergency haircut surgery so he could hear again. 10/10 miraculous af https://t.co/fUyDIFkBwx,10,10,,True,https://pbs.twimg.com/media/Chiv6BAW4AAiQvH.jpg,2,4900,1379,Pomeranian
864,727314416056803329,2016-05-03 01:50:44+00:00,iPhone,This pupper was about to explain where that dirt came from but then decided against it. 11/10 https://t.co/SbaelU6zRs,11,10,,True,https://pbs.twimg.com/media/Chfwmd9U4AQTf1b.jpg,2,3623,834,Toy Poodle
865,727286334147182592,2016-05-02 23:59:09+00:00,iPhone,I swear to god if we get sent another Blue Madagascan Peacock we'll deactivate. We ðŸ‘ Only ðŸ‘ Rate ðŸ‘ Dogs... 9/10 https://t.co/bbta2Q4URK,9,10,,False,https://pbs.twimg.com/media/ChfXDrGUkAEAtF-.jpg,1,3324,920,Chihuahua
866,727175381690781696,2016-05-02 16:38:15+00:00,iPhone,This is Karll. He just wants to go kayaking. 10/10 please someone take Karll kayaking already https://t.co/vXLkvyNQHp,10,10,Karll,False,https://pbs.twimg.com/media/ChdyJvdWwAA5HGd.jpg,2,4209,1540,Flat-Coated Retriever
867,726935089318363137,2016-05-02 00:43:25+00:00,iPhone,This is Sprout. He's just precious af. 12/10 I'd do anything for Sprout https://t.co/DxlX1yTVYY,12,10,Sprout,False,https://pbs.twimg.com/media/ChaXmuAXEAE66KP.jpg,2,7496,2738,Toy Poodle
868,726887082820554753,2016-05-01 21:32:40+00:00,iPhone,This is Blitz. He's a new dad struggling to cope mentally with the pressures of being a father. Sick shades 10/10 https://t.co/2AVcJ2BZsy,10,10,Blitz,False,https://pbs.twimg.com/media/ChZr8SdWIAAVQKt.jpg,1,4195,1677,Soft-Coated Wheaten Terrier
869,726828223124897792,2016-05-01 17:38:46+00:00,iPhone,This is Bloop. He's a Phoenician Winnebago. Tongue is just wow. That box is all he has (tragic). 12/10 would caress https://t.co/DWNrPPXgHA,12,10,Bloop,False,https://pbs.twimg.com/media/ChY2aHyWMAAbNQE.jpg,1,3882,1124,Miniature Pinscher
870,726224900189511680,2016-04-30 01:41:23+00:00,iPhone,I'm getting super heckin frustrated with you all sending in non canines like this ostrich. We only rate dogs... 9/10 https://t.co/Rgbni2Ns8z,9,10,,False,https://pbs.twimg.com/media/ChQRsYaW0AETD7z.jpg,1,4811,1302,Standard Poodle
871,725842289046749185,2016-04-29 00:21:01+00:00,iPhone,This is Colby. He's currently regretting all those times he shook your hand for an extra treat. 12/10 https://t.co/vtVHtKFtBH,12,10,Colby,False,https://pbs.twimg.com/media/ChK1tdBWwAQ1flD.jpg,1,7691,2970,Toy Poodle
872,725786712245440512,2016-04-28 20:40:11+00:00,iPhone,Say hello to Lillie. She's a Rutabagan Floofem. Poor pupper ate and then passed out. 11/10 relatable af https://t.co/uIdGqug9rw,11,10,Lillie,True,https://pbs.twimg.com/media/ChKDKmIWIAIJP_e.jpg,1,4537,1527,Chow
873,725729321944506368,2016-04-28 16:52:08+00:00,iPhone,This is Lola. She's a Butternut Splishnsplash. They are known to be ferocious af. 12/10 would absolutely still pet https://t.co/adQt5a6TZU,12,10,Lola,False,https://pbs.twimg.com/media/ChJO9YaWYAEL0zC.jpg,1,5646,2009,Boxer
874,724983749226668032,2016-04-26 15:29:30+00:00,iPhone,This is Fred-Rick. He dabbles in parkour. The elevation gives him power. 12/10 hopefully visiting a mailbox near you https://t.co/qFqLtudIiD,12,10,Fred,False,https://pbs.twimg.com/media/Cg-o3w0WgAANXdv.jpg,1,4040,1462,Golden Retriever
875,724771698126512129,2016-04-26 01:26:53+00:00,iPhone,Nothin better than a doggo and a sunset. 11/10 https://t.co/JlFqOhrHEs,11,10,,True,https://pbs.twimg.com/media/Cg7n_-OU8AA5RR1.jpg,2,2593,725,German Short-Haired Pointer
876,724405726123311104,2016-04-25 01:12:38+00:00,iPhone,This is Ashleigh. She's having Coachella withdrawals. Didn't even go tho. 10/10 stay strong pupper https://t.co/nRUaKWnJfH,10,10,Ashleigh,True,https://pbs.twimg.com/media/Cg2bKLAWwAA0WEm.jpg,1,5800,1847,Golden Retriever
877,724049859469295616,2016-04-24 01:38:33+00:00,iPhone,This is Kreggory. He just took a look at his student debt. 10/10 can't even comprehend it https://t.co/XTsZTgilnT,10,10,Kreggory,False,https://pbs.twimg.com/media/CgxXf1TWYAEjY61.jpg,1,4738,1984,Border Collie
878,724046343203856385,2016-04-24 01:24:35+00:00,iPhone,"This is Sarge. Not even he knows what his tongue is doing, but it's pretty damn spectacular. 10/10 https://t.co/pIQEdbBxdL",10,10,Sarge,False,https://pbs.twimg.com/media/CgxUTS_XEAAC0pv.jpg,1,2901,620,Boxer
879,724004602748780546,2016-04-23 22:38:43+00:00,iPhone,This is Luther. He saw a ghost. Spooked af. 11/10 hang in there pupper https://t.co/EdKG43VvEl,11,10,Luther,True,https://pbs.twimg.com/media/CgwuWCeW4AAsgbD.jpg,3,4561,1790,Pug
880,723912936180330496,2016-04-23 16:34:28+00:00,iPhone,This is Sugar. She's a Bolivian Superfloof. Spherical af. 12/10 would never let go of https://t.co/AhMfUu6Onm,12,10,Sugar,False,https://pbs.twimg.com/media/Cgva-QqUUAA7Hv9.jpg,1,4236,1374,Samoyed
881,723688335806480385,2016-04-23 01:41:59+00:00,iPhone,This is Reginald. He starts screaming at random. 12/10 cuddly af https://t.co/YgNuDQbv89,12,10,Reginald,False,https://pbs.twimg.com/media/CgsOszGW0AAruKp.jpg,2,8435,3347,Chow
882,723673163800948736,2016-04-23 00:41:42+00:00,iPhone,This is Ivar. She is a badass Viking warrior. Will sack your village. 10/10 savage af https://t.co/Dz6MiVssVU,10,10,Ivar,False,https://pbs.twimg.com/media/CgsA5eFWgAAu0qn.jpg,1,3291,1011,Golden Retriever
883,723179728551723008,2016-04-21 16:00:57+00:00,iPhone,This is Jangle. She's addicted to broccoli. It's the only thing she cares about. Tragic af. 8/10 get help pup https://t.co/8dNWp1cSEa,8,10,Jangle,False,https://pbs.twimg.com/media/CglAHjAUgAAfxcq.jpg,1,5761,2110,Norwegian Elkhound
884,722974582966214656,2016-04-21 02:25:47+00:00,iPhone,Happy 4/20 from the squad! 13/10 for all https://t.co/eV1diwds8a,4,20,,False,https://pbs.twimg.com/media/CgiFjIpWgAA4wVp.jpg,1,4493,1764,Great Dane
885,722613351520608256,2016-04-20 02:30:23+00:00,iPhone,Meet Schnitzel. He's a Tropicana Floofboop. Getting too big for his favorite basket. 12/10 just so damn fluffy https://t.co/qjd0UJKYUY,12,10,Schnitzel,False,https://pbs.twimg.com/media/Cgc9AjMVIAERdUA.jpg,1,5393,1831,Labrador Retriever
886,721503162398597120,2016-04-17 00:58:53+00:00,iPhone,This is Panda. He's happy af. 11/10 https://t.co/IOAk9i4UvE,11,10,Panda,False,https://pbs.twimg.com/media/CgNLS1PW8AAxWSN.jpg,3,5086,2124,Pomeranian
887,721001180231503872,2016-04-15 15:44:11+00:00,iPhone,This is Oliver. Bath time is upon him. His fear of the wetness postpones his ultimate pupper destiny. 11/10 https://t.co/AFzzKqR4tT,11,10,Oliver,True,https://pbs.twimg.com/media/CgGCvxAUkAAx55r.jpg,1,2748,686,Samoyed
888,720785406564900865,2016-04-15 01:26:47+00:00,iPhone,This is Archie. He hears everything you say. Doesn't matter where you are. 12/10 https://t.co/0l4I8famYp,12,10,Archie,False,https://pbs.twimg.com/media/CgC-gMCWcAAawUE.jpg,1,3400,866,Chihuahua
889,720775346191278080,2016-04-15 00:46:48+00:00,iPhone,This is Berkeley. He's in a predicament. 10/10 someone help him https://t.co/XSEXdQupej,10,10,Berkeley,False,https://pbs.twimg.com/media/CgC1WqMW4AI1_N0.jpg,1,2702,760,Newfoundland
890,720415127506415616,2016-04-14 00:55:25+00:00,iPhone,Garden's coming in nice this year. 10/10 https://t.co/5Lra3e4rrw,10,10,,False,https://pbs.twimg.com/media/Cf9tuHUWsAAHSrV.jpg,1,4503,1681,Rottweiler
891,720389942216527872,2016-04-13 23:15:21+00:00,iPhone,This is RalphÃ©. He patrols the lake. Looking for babes. 11/10 https://t.co/Pb6iMmo0wk,11,10,RalphÃ©,False,https://pbs.twimg.com/media/Cf9W1J-UMAErahM.jpg,1,6974,2840,Pembroke
893,720059472081784833,2016-04-13 01:22:10+00:00,iPhone,This is Charleson. He lost his plunger. Looked everywhere. Can't find it. So sad. 9/10 would comfort https://t.co/pRHX8yn9Yu,9,10,Charleson,False,https://pbs.twimg.com/media/Cf4qRcmWEAA9V4h.jpg,1,4229,1268,Mexican Hairless
894,720043174954147842,2016-04-13 00:17:25+00:00,iPhone,This is Neptune. He's a Snowy Swiss Mountain Floofapolis. Cheeky wink. Tongue nifty af. 11/10 would pet so firmly https://t.co/SoZq2Xoopv,11,10,Neptune,False,https://pbs.twimg.com/media/Cf4bcm8XEAAX4xV.jpg,1,5332,2253,Samoyed
895,719991154352222208,2016-04-12 20:50:42+00:00,iPhone,This doggo was initially thrilled when she saw the happy cartoon pup but quickly realized she'd been deceived. 10/10 https://t.co/mvnBGaWULV,10,10,,True,https://pbs.twimg.com/media/Cf3sH62VAAA-LiP.jpg,2,5281,1979,Golden Retriever
897,719551379208073216,2016-04-11 15:43:12+00:00,iPhone,This is Harnold. He accidentally opened the front facing camera. 10/10 get it together Harnold https://t.co/S6JHaSMtln,10,10,Harnold,False,https://pbs.twimg.com/media/CfxcKU6W8AE-wEx.jpg,1,5515,2192,Malamute
898,719367763014393856,2016-04-11 03:33:34+00:00,iPhone,Meet Sid &amp; Murphy. Murphy floats alongside Sid and whispers motivational quotes in his ear. Magical af. Both 11/10 https://t.co/7mmjyearQW,11,10,Sid,False,https://pbs.twimg.com/media/Cfu1KSRXEAACC5X.jpg,1,3022,827,Soft-Coated Wheaten Terrier
899,719339463458033665,2016-04-11 01:41:07+00:00,iPhone,Say hello to Lucy and Sophie. They think they're the same size. Both 10/10 would snug at same time https://t.co/HW50zkcf2R,10,10,Lucy,False,https://pbs.twimg.com/media/Cfuba6NW4AIeMHk.jpg,1,4822,1403,Golden Retriever
900,719332531645071360,2016-04-11 01:13:34+00:00,iPhone,This is Pippa. She managed to start the car but is waiting for you to buckle up before driving. Responsible af 11/10 https://t.co/htrlmC7saz,11,10,Pippa,False,https://pbs.twimg.com/media/CfuVGl3WEAEKb16.jpg,1,3711,1078,Dandie Dinmont
901,718971898235854848,2016-04-10 01:20:33+00:00,iPhone,This is Sadie. She is prepared for battle. 10/10 https://t.co/JRckDkZVRT,10,10,Sadie,False,https://pbs.twimg.com/media/CfpNGTHUIAAA8XC.jpg,1,3818,1231,Golden Retriever
902,718939241951195136,2016-04-09 23:10:47+00:00,iPhone,This is Otis. Everybody look at Otis. 12/10 would probably faint while petting https://t.co/I9qoe1uEih,12,10,Otis,False,https://pbs.twimg.com/media/CfovbK4WIAAkTn3.jpg,1,5720,1973,Pembroke
903,718631497683582976,2016-04-09 02:47:55+00:00,iPhone,We normally don't rate marshmallows but this one appears to be flawlessly toasted so I'll make an exception. 10/10 https://t.co/D9jbbmPmos,10,10,,False,https://pbs.twimg.com/media/CfkXiX6W4AAmICF.jpg,1,20697,9126,Pomeranian
904,718613305783398402,2016-04-09 01:35:37+00:00,iPhone,This is Carper. He's a Tortellini Angiosperm. In desperate need of a petting. 11/10 would hug softly https://t.co/lK9YDkRzPj,11,10,Carper,False,https://pbs.twimg.com/media/CfkG_PMWsAAH0MZ.jpg,1,2669,542,Labrador Retriever
905,718540630683709445,2016-04-08 20:46:50+00:00,iPhone,Get you a pup that can do both. 10/10 https://t.co/zSbyvm62xZ,10,10,,False,https://pbs.twimg.com/media/CfjE5FRXEAErFWR.jpg,2,2730,1137,Maltese Dog
906,718460005985447936,2016-04-08 15:26:28+00:00,iPhone,Meet Bowie. He's listening for underground squirrels. Smart af. Left eye is considerably magical. 9/10 would so pet https://t.co/JyNmyjy3fe,9,10,Bowie,False,https://pbs.twimg.com/media/Cfh7j6CWQAAndTd.jpg,1,2846,602,Boston Bull
908,718246886998687744,2016-04-08 01:19:36+00:00,iPhone,This is Alexanderson. He's got a weird ass birth mark. Dreadful at fetch. Won't eat kibble. 3/10 wtf @Target https://t.co/FmxOpf2Sgl,3,10,Alexanderson,False,https://pbs.twimg.com/media/Cfe5tLWXEAIaoFO.jpg,1,2115,565,Chihuahua
909,718234618122661888,2016-04-08 00:30:51+00:00,iPhone,This is Suki. She was born with a blurry tail (unfortunate). Next level tongue tho. 11/10 nifty hardwood https://t.co/05S8oYztgb,11,10,Suki,False,https://pbs.twimg.com/media/CfeukpmW4AEGjOE.jpg,1,4217,1127,Malamute
910,717841801130979328,2016-04-06 22:29:56+00:00,iPhone,This is Barclay. His father was a banana. 11/10 appeeling af https://t.co/ucOEfr2rjV,11,10,Barclay,False,https://pbs.twimg.com/media/CfZJTphWAAAl5Ys.jpg,1,2660,670,Brittany Spaniel
912,717537687239008257,2016-04-06 02:21:30+00:00,iPhone,People please. This is a Deadly Mediterranean Plop T-Rex. We only rate dogs. Only send in dogs. Thanks you... 11/10 https://t.co/2ATDsgHD4n,11,10,,False,https://pbs.twimg.com/media/CfU0t75W4AAUo9V.jpg,1,6281,2069,Golden Retriever
913,717421804990701568,2016-04-05 18:41:02+00:00,iPhone,This is Ebby. She's a Zimbabwean Feta. Embarrassed by ridiculously squishy face. 9/10 would squeeze softly https://t.co/LBJqxMGaHi,9,10,Ebby,False,https://pbs.twimg.com/media/CfTLUYWXEAEkyES.jpg,2,3446,945,Miniature Pinscher
914,717047459982213120,2016-04-04 17:53:31+00:00,iPhone,This is FlÃ¡vio (pronounced Baxter). He's a Benesnoop Cumberdog. Super rare. Symmetrical. 12/10 would pet so well https://t.co/fGgleFiBPq,12,10,FlÃ¡vio,False,https://pbs.twimg.com/media/CfN23ArXEAEkZkz.jpg,1,6826,2135,Golden Retriever
915,717009362452090881,2016-04-04 15:22:08+00:00,iPhone,This is Smokey. He's having some sort of existential crisis. 10/10 hang in there pupper https://t.co/JmgF4dMpw0,10,10,Smokey,True,https://pbs.twimg.com/media/CfNUNetW8AAekHx.jpg,1,3583,1102,Siberian Husky
916,716802964044845056,2016-04-04 01:41:58+00:00,iPhone,This is Link. He struggles with couches. 10/10 would assist https://t.co/SbX4e6Yg3o,10,10,Link,False,https://pbs.twimg.com/media/CfKYfeBXIAAopp2.jpg,2,4627,1317,Malinois
917,716791146589110272,2016-04-04 00:55:01+00:00,iPhone,Meet Jennifur. She's supposed to be navigating. Not even buckled up. Insubordinate &amp; churlish. 11/10 would still pet https://t.co/h0trcJohYO,11,10,Jennifur,False,https://pbs.twimg.com/media/CfKNvU8WsAAvI9Z.jpg,1,5204,1474,Pomeranian
918,716439118184652801,2016-04-03 01:36:11+00:00,iPhone,This is Bluebert. He just saw that both #FinalFur match ups are split 50/50. Amazed af. 11/10 https://t.co/Kky1DPG4iq,50,50,Bluebert,False,https://pbs.twimg.com/media/CfFNk7cWAAA-hND.jpg,1,2574,247,Siberian Husky
919,716285507865542656,2016-04-02 15:25:47+00:00,iPhone,This is Stephanus. She stays woke. 12/10 https://t.co/WIWabMngQZ,12,10,Stephanus,False,https://pbs.twimg.com/media/CfDB3aJXEAAEZNv.jpg,1,3041,1225,Yorkshire Terrier
920,716080869887381504,2016-04-02 01:52:38+00:00,iPhone,Here's a super majestic doggo and a sunset 11/10 https://t.co/UACnoyi8zu,11,10,,True,https://pbs.twimg.com/media/CfAHv83UMAIEQYx.jpg,1,5272,1935,Golden Retriever
921,715928423106027520,2016-04-01 15:46:52+00:00,iPhone,This is Bubbles. He's a Yorkshire Piccolope. 11/10 would snug aggressively https://t.co/3BhMojONxq,11,10,Bubbles,False,https://pbs.twimg.com/media/Ce99GhLW8AAHG38.jpg,1,3485,987,Pug
922,715733265223708672,2016-04-01 02:51:22+00:00,iPhone,This is a taco. We only rate dogs. Please only send in dogs. Dogs are what we rate. Not tacos. Thank you... 10/10 https://t.co/cxl6xGY8B9,10,10,,False,https://pbs.twimg.com/media/Ce7LlUeUUAEQkQl.jpg,1,5093,1920,Dandie Dinmont
923,715696743237730304,2016-04-01 00:26:15+00:00,iPhone,Meet Toby. He's a Lithuanian High-Steppin Stickeroo. One of the more accomplished Stickeroos around. 10/10 so nifty https://t.co/cYPHuJYTjC,10,10,Toby,False,https://pbs.twimg.com/media/Ce6qZC2WAAAcSoI.jpg,1,4257,1454,Staffordshire Bullterrier
924,715680795826982913,2016-03-31 23:22:53+00:00,iPhone,This is Zeus. He's downright fabulous. 12/10 https://t.co/sSugyyRuTp,12,10,Zeus,False,https://pbs.twimg.com/media/Ce6b4MPWwAA22Xm.jpg,1,4719,1813,Golden Retriever
926,715342466308784130,2016-03-31 00:58:29+00:00,iPhone,This is Oscar. He's a world renowned snowball inspector. It's a ruff job but someone has to do it. 10/10 great guy https://t.co/vSufMAKm3C,10,10,Oscar,False,https://pbs.twimg.com/media/Ce1oLNqWAAE34w7.jpg,1,3294,768,West Highland White Terrier
927,715220193576927233,2016-03-30 16:52:36+00:00,iPhone,This is Nico. His selfie game is strong af. Excellent use of a sneaky tongue slip. 10/10 star material https://t.co/1OBdJkMOFx,10,10,Nico,False,https://pbs.twimg.com/media/Cez49UqWsAIRQXc.jpg,1,2630,736,Chihuahua
928,715200624753819648,2016-03-30 15:34:51+00:00,iPhone,This is Michelangelope. He's half coffee cup. Rare af. 12/10 would hug until someone stopped me https://t.co/tvVDY0G911,12,10,Michelangelope,False,https://pbs.twimg.com/media/CeznK6IWEAEFUPq.jpg,1,5578,2110,Chihuahua
929,715009755312439296,2016-03-30 02:56:24+00:00,iPhone,This is Siba. She's remarkably mobile. Very sleepy as well. 12/10 would happily transport https://t.co/TjnI33RE1i,12,10,Siba,False,https://pbs.twimg.com/media/Cew5kyOWsAA8Y_o.jpg,1,4550,1392,Chihuahua
930,714982300363173890,2016-03-30 01:07:18+00:00,iPhone,This is Calbert. He forgot to clear his Google search history. 9/10 rookie mistake Calbert https://t.co/jRm5J3YCmj,9,10,Calbert,False,https://pbs.twimg.com/media/CewgnHAXEAAdbld.jpg,1,4094,1166,Brittany Spaniel
931,714957620017307648,2016-03-29 23:29:14+00:00,iPhone,This is Curtis. He's an Albino Haberdasher. Terrified of dandelions. They really spook him up. 10/10 it'll be ok pup https://t.co/s8YcfZrWhK,10,10,Curtis,False,https://pbs.twimg.com/media/CewKKiOWwAIe3pR.jpg,1,4503,1595,Great Pyrenees
933,714606013974974464,2016-03-29 00:12:05+00:00,iPhone,Here are two lil cuddly puppers. Both 12/10 would snug like so much https://t.co/zO4eb7C4tG,12,10,,False,https://pbs.twimg.com/media/CerKYG8WAAM1aE-.jpg,1,3938,1038,Norfolk Terrier
