,tweet_id,timestamp,source,text,rating_numerator,rating_denominator,name,nickname,jpg_url,img_num,favorites,retweets,dog_label
1393,679062614270468097,2015-12-21 22:15:18+00:00,iPhone,This is Chompsky. He lives up to his name. 11/10 https://t.co/Xl37lQEWd0,11,10,Chompsky,False,https://pbs.twimg.com/media/CWyD2HGUYAQ1Xa7.jpg,2,18712,9299,Schipperke
1394,679047485189439488,2015-12-21 21:15:11+00:00,iPhone,This dog doesn't know how to stairs. Quite tragic really. 9/10 get it together pup https://t.co/kTpr9PTMg1,9,10,,False,https://pbs.twimg.com/media/CWx2FaLWcAEQ3vh.jpg,1,2460,781,Golden Retriever
1395,678991772295516161,2015-12-21 17:33:48+00:00,iPhone,If your Monday isn't going so well just take a look at this. Both 12/10 https://t.co/GJT6SILPGU,12,10,,False,https://pbs.twimg.com/media/CWxDaXHWsAAWV8W.jpg,1,2537,1333,Eskimo Dog
1396,678969228704284672,2015-12-21 16:04:13+00:00,iPhone,Meet Lola. She's a Metamorphic Chartreuse. Plays with her food. Insubordinate and churlish. Exquisite hardwood 11/10 https://t.co/etpBNXwN7f,11,10,Lola,False,https://pbs.twimg.com/media/CWwu6OLUkAEo3gq.jpg,1,1796,528,Labrador Retriever
1397,678800283649069056,2015-12-21 04:52:53+00:00,iPhone,Here's a pupper with some mean tan lines. Snazzy sweater though 12/10 https://t.co/DpCSVsl6vu,12,10,,True,https://pbs.twimg.com/media/CWuVQSLW4AAI3w9.jpg,1,2810,1018,Labrador Retriever
1398,678798276842360832,2015-12-21 04:44:55+00:00,iPhone,This is Linda. She fucking hates trees. 7/10 https://t.co/blaY85FIxR,7,10,Linda,False,https://pbs.twimg.com/media/CWuTbAKUsAAvZHh.jpg,1,3804,1350,Airedale
1399,678774928607469569,2015-12-21 03:12:08+00:00,iPhone,This is Tug. He's not required to wear the cone he just wants his voice to project more clearly. 11/10 https://t.co/Sp739Ou2qx,11,10,Tug,False,https://pbs.twimg.com/media/CWt-MNIWEAAUC9S.jpg,1,3037,1043,Pembroke
1401,678764513869611008,2015-12-21 02:30:45+00:00,iPhone,"Meet Wilson. He got caught humping the futon. He's like ""dude, help me out here"" 10/10 I'd help Wilson out https://t.co/m6XoclB0qv",10,10,Wilson,False,https://pbs.twimg.com/media/CWt0ubZWcAAkFER.jpg,1,1788,544,Irish Terrier
1402,678755239630127104,2015-12-21 01:53:54+00:00,iPhone,This is Dash. He didn't think the water would be that cold. Damn it Dash it's December. Think a little. 10/10 https://t.co/NqcOwG8pxW,10,10,Dash,False,https://pbs.twimg.com/media/CWtsSQAUkAAnWws.jpg,1,7802,3741,Malamute
1403,678740035362037760,2015-12-21 00:53:29+00:00,iPhone,Meet Tango. He's a large dog. Doesn't care much for personal space. Owner isn't very accepting. Tongue slip. 6/10 https://t.co/p2T5kGebxe,6,10,Tango,False,https://pbs.twimg.com/media/CWtede2WIAAF_AJ.jpg,1,4099,1926,Beagle
1405,678643457146150913,2015-12-20 18:29:43+00:00,iPhone,Meet Grizz. He just arrived. Couldn't wait until Christmas. Worried bc he saw the swastikas on the carpet. 10/10 https://t.co/QBGwYrT7rv,10,10,Grizz,False,https://pbs.twimg.com/media/CWsGnyMVEAAM1Y1.jpg,1,2250,489,Labrador Retriever
1406,678446151570427904,2015-12-20 05:25:42+00:00,iPhone,Touching scene here. Really stirs up the emotions. The bond between father &amp; son. So beautiful. 10/10 for both pups https://t.co/AJWJHov5gx,10,10,,False,https://pbs.twimg.com/media/CWpTLOYWsAEDhcU.jpg,1,4358,1785,Staffordshire Bullterrier
1407,678424312106393600,2015-12-20 03:58:55+00:00,iPhone,This is Crystal. She's a shitty fireman. No sense of urgency. People could be dying Crystal. 2/10 just irresponsible https://t.co/rtMtjSl9pz,2,10,Crystal,False,https://pbs.twimg.com/media/CWo_T8gW4AAgJNo.jpg,1,5916,2880,Maltese Dog
1408,678410210315247616,2015-12-20 03:02:53+00:00,iPhone,Say hello to Jerome. He can shoot french fries out of his mouth at insane speeds. Deadly af. 10/10 https://t.co/dIy88HwrX8,10,10,Jerome,False,https://pbs.twimg.com/media/CWoyfMiWUAAmGdd.jpg,1,4640,2072,Schipperke
1409,678399652199309312,2015-12-20 02:20:55+00:00,iPhone,This made my day. 12/10 please enjoy https://t.co/VRTbo3aAcm,12,10,,False,https://pbs.twimg.com/ext_tw_video_thumb/678399528077250560/pu/img/BOjUNHRsYLeSo0hl.jpg,1,61794,30742,Bedlington Terrier
1410,678396796259975168,2015-12-20 02:09:34+00:00,iPhone,These little fellas have opposite facial expressions. Both 12/10 https://t.co/LmThv0GWen,12,10,,False,https://pbs.twimg.com/media/CWomSU_XIAAUYiK.jpg,2,1731,478,Pembroke
1411,678389028614488064,2015-12-20 01:38:42+00:00,iPhone,"This is Bella. She just learned that her final grade in chem was a 92.49 
poor pupper 11/10 https://t.co/auOoKuoveM",11,10,Bella,True,https://pbs.twimg.com/media/CWofOHUWUAACGVa.jpg,1,2044,473,Miniature Pinscher
1412,678380236862578688,2015-12-20 01:03:46+00:00,iPhone,This is Crumpet. He underestimated the snow. Quickly retreating. 10/10 https://t.co/a0Zx5LDFZa,10,10,Crumpet,False,https://pbs.twimg.com/media/CWoXOfSUAAA4u8g.jpg,1,2655,1020,Samoyed
1413,678341075375947776,2015-12-19 22:28:09+00:00,iPhone,This pupper likes tape. 12/10 https://t.co/cSp6w5GWgm,12,10,,True,https://pbs.twimg.com/media/CWnznDTU4AAa-6P.jpg,1,1896,612,Golden Retriever
1414,678334497360859136,2015-12-19 22:02:01+00:00,iPhone,This is Rosie. She has a snazzy bow tie and a fin for a tail. Probably super fast underwater. Cool socks 10/10 https://t.co/GO76MdGBs0,10,10,Rosie,False,https://pbs.twimg.com/media/CWntoDVWcAEl3NB.jpg,1,1427,304,Norfolk Terrier
1415,678278586130948096,2015-12-19 18:19:51+00:00,iPhone,Another spooky pupper here. Most definitely floating. No legs. Probably knows some dark magic. 10/10 very spooked https://t.co/JK8MByRzgj,10,10,,True,https://pbs.twimg.com/media/CWm6xySUEAAqfFU.jpg,1,12531,6857,Maltese Dog
1416,678255464182861824,2015-12-19 16:47:58+00:00,iPhone,This is Jessifer. She is a Bismoth Teriyaki. Flowers being attacked by hurricanes on bandana (rad). 9/10 stellar pup https://t.co/nZhmRwZzWv,9,10,Jessifer,False,https://pbs.twimg.com/media/CWmlvxJU4AEAqaN.jpg,1,1726,418,Chihuahua
1417,678021115718029313,2015-12-19 01:16:45+00:00,iPhone,This is Reese. He likes holding hands. 12/10 https://t.co/cbLroGCbmh,12,10,Reese,False,https://pbs.twimg.com/media/CWjQm5gXAAA9GkD.jpg,1,15018,7148,Miniature Pinscher
1418,677918531514703872,2015-12-18 18:29:07+00:00,iPhone,"""Everything looks pretty good in there. Make sure to brush your gums. Been flossing? How's school going?"" Both 10/10 https://t.co/lWL2IMJqLR",10,10,,False,https://pbs.twimg.com/media/CWhzTbzWUAAEAUN.jpg,1,1476,463,Eskimo Dog
1419,677895101218201600,2015-12-18 16:56:01+00:00,iPhone,Guys this was terrifying. Really spooked me up. We don't rate ghosts. We rate dogs. Please only send dogs... 9/10 https://t.co/EJImi1udYb,9,10,,False,https://pbs.twimg.com/media/CWhd_7WWsAAaqWG.jpg,1,5275,2384,Dalmatian
1420,677716515794329600,2015-12-18 05:06:23+00:00,iPhone,IT'S PUPPERGEDDON. Total of 144/120 ...I think https://t.co/ZanVtAtvIq,144,120,,False,https://pbs.twimg.com/media/CWe7kw9W4AE8UJh.jpg,1,3323,1104,Chow
1421,677700003327029250,2015-12-18 04:00:46+00:00,iPhone,This is Ralph. He's an interpretive dancer. 10/10 https://t.co/zoDdPyPFsa,10,10,Ralph,False,https://pbs.twimg.com/media/CWesj06W4AAIKl8.jpg,1,3689,1622,Siberian Husky
1422,677698403548192770,2015-12-18 03:54:25+00:00,iPhone,This is Sadie. She got her holidays confused. 9/10 damn it Sadie https://t.co/fm7HxOsuPK,9,10,Sadie,False,https://pbs.twimg.com/media/CWerGmOXAAAm6NY.jpg,1,1332,363,Shih-Tzu
1423,677687604918272002,2015-12-18 03:11:30+00:00,iPhone,This was Cindy's face when she heard Susan forgot the snacks for after the kid's soccer game. 11/10 https://t.co/gzkuVGRgAD,11,10,,False,https://pbs.twimg.com/media/CWehRdEWIAAySyO.jpg,1,2681,950,Pembroke
1424,677673981332312066,2015-12-18 02:17:22+00:00,iPhone,Endangered triangular pup here. Could be a wizard. Caught mid-laugh. No legs. Just fluff. Probably a wizard. 9/10 https://t.co/GFVIHIod0Z,9,10,,False,https://pbs.twimg.com/media/CWeU5LBWEAA8F0J.jpg,1,3603,1677,Maltese Dog
1426,677644091929329666,2015-12-18 00:18:36+00:00,iPhone,This is a dog swinging. I really enjoyed it so I hope you all do as well. 11/10 https://t.co/Ozo9KHTRND,11,10,,False,https://pbs.twimg.com/ext_tw_video_thumb/677644010865999872/pu/img/zVHEMYnJKzq1SauT.jpg,1,2040,886,Chihuahua
1428,677565715327688705,2015-12-17 19:07:09+00:00,iPhone,Contortionist pup here. Inside pentagram. Clearly worships Satan. Known to slowly push fragile stuff off tables 6/10 https://t.co/EX9oR55VMe,6,10,,False,https://pbs.twimg.com/media/CWcybBmWcAAigAQ.jpg,1,1409,513,Basset
1429,677557565589463040,2015-12-17 18:34:46+00:00,iPhone,Reckless pupper here. Not even looking at road. Absolute menace. No regard for fellow pupper lives. 10/10 still cute https://t.co/96IBkOYB7j,10,10,,True,https://pbs.twimg.com/media/CWcrAVQWEAA6QMp.jpg,1,2665,1322,Shih-Tzu
1430,677547928504967168,2015-12-17 17:56:29+00:00,iPhone,Not much to say here. I just think everyone needs to see this. 12/10 https://t.co/AGag0hFHpe,12,10,,False,https://pbs.twimg.com/media/CWciPonWEAUOqLD.jpg,1,7568,4076,American Staffordshire Terrier
1431,677530072887205888,2015-12-17 16:45:31+00:00,iPhone,Say hello to Axel. He's a Black Chevy Pinot on wheels. 0 to 60 in 5.7 seconds (if downhill). 9/10 I call shotgun https://t.co/DKe9DBnnHE,9,10,Axel,False,https://pbs.twimg.com/media/CWcSAI-WUAAOB9W.jpg,1,1161,250,Staffordshire Bullterrier
1432,677334615166730240,2015-12-17 03:48:51+00:00,iPhone,This dog gave up mid jump. 9/10 https://t.co/KmMv3Y2zI8,9,10,,False,https://pbs.twimg.com/media/CWZgPPUWUAAUOvu.jpg,2,1477,328,Lakeland Terrier
1433,677331501395156992,2015-12-17 03:36:28+00:00,iPhone,Meet Humphrey. He's a Northern Polyp Viagra. One ear works. Face stuck like that. Always surprised. 9/10 petable af https://t.co/FS7eJQM2F4,9,10,Humphrey,False,https://pbs.twimg.com/media/CWZdaGxXAAAjGjb.jpg,1,1189,265,Beagle
1434,677328882937298944,2015-12-17 03:26:04+00:00,iPhone,This is Derek. All the dogs adore Derek. He's a great guy. 10/10 really solid pup https://t.co/KgcsGNb61s,10,10,Derek,False,https://pbs.twimg.com/media/CWZbBlAUsAAjRg5.jpg,1,3938,1693,Kelpie
1435,677314812125323265,2015-12-17 02:30:09+00:00,iPhone,"Meet Tassy &amp; Bee. Tassy is pretty chill, but Bee is convinced the Ruffles are haunted. 10/10 &amp; 11/10 respectively https://t.co/fgORpmTN9C",10,10,Tassy,False,https://pbs.twimg.com/media/CWZOOIUW4AAQrX_.jpg,2,1799,611,Blenheim Spaniel
1436,677301033169788928,2015-12-17 01:35:24+00:00,iPhone,This is Juckson. He's totally on his way to a nascar race. 5/10 for Juckson https://t.co/IoLRvF0Kak,5,10,Juckson,False,https://pbs.twimg.com/media/CWZBsjPWsAAZFFl.jpg,1,1362,471,Japanese Spaniel
1437,677269281705472000,2015-12-16 23:29:14+00:00,iPhone,This is the happiest pupper I've ever seen. 10/10 would trade lives with https://t.co/ep8ATEJwRb,10,10,,True,https://pbs.twimg.com/media/CWYk0WxWoAAEwRt.jpg,1,2164,790,Shetland Sheepdog
1439,677187300187611136,2015-12-16 18:03:28+00:00,iPhone,Here we see a Byzantine Rigatoni. Very aerodynamic. No eyes. Actually not windy here they just look like that. 9/10 https://t.co/gzI0m6wXRo,9,10,,False,https://pbs.twimg.com/media/CWXaQMBWcAAATDi.jpg,1,2981,1033,English Setter
1440,676975532580409345,2015-12-16 04:01:59+00:00,iPhone,This is Cooper. He doesn't know how cheese works. Likes the way it feels on his face. Cheeky tongue slip. 11/10 https://t.co/j1zczS0lI5,11,10,Cooper,False,https://pbs.twimg.com/media/CWUZpydWcAAeipD.jpg,1,3015,1203,Malamute
1441,676957860086095872,2015-12-16 02:51:45+00:00,iPhone,10/10 I'd follow this dog into battle no questions asked https://t.co/ngTNXYQF0L,10,10,,False,https://pbs.twimg.com/ext_tw_video_thumb/676957802976419840/pu/img/dCj-qlXo73A5hf6Q.jpg,1,2395,907,Labrador Retriever
1442,676949632774234114,2015-12-16 02:19:04+00:00,iPhone,This is Tyrus. He's a Speckled Centennial Ticonderoga. Terrified of floating red ball. Nifty bandana. 8/10 v petable https://t.co/HqM3YhCaaa,8,10,Tyrus,False,https://pbs.twimg.com/media/CWUCGMtWEAAjXnS.jpg,1,1413,448,Welsh Springer Spaniel
1444,676946864479084545,2015-12-16 02:08:04+00:00,iPhone,This pups goal was to get all four feet as close to each other as possible. Valiant effort 12/10 https://t.co/2mXALbgBTV,12,10,,False,https://pbs.twimg.com/media/CWT_lOQWUAAXPaY.jpg,1,1844,426,Pekinese
1446,676936541936185344,2015-12-16 01:27:03+00:00,iPhone,Here we see a rare pouched pupper. Ample storage space. Looks alert. Jumps at random. Kicked open that door. 8/10 https://t.co/mqvaxleHRz,8,10,,True,https://pbs.twimg.com/media/CWT2MUgWIAECWig.jpg,1,13809,5515,Chesapeake Bay Retriever
1448,676864501615042560,2015-12-15 20:40:47+00:00,iPhone,Meet Ash. He's just a head now. Lost his body during the Third Crusade. Still in good spirits. 10/10 would pet well https://t.co/NJj2uP0atK,10,10,Ash,False,https://pbs.twimg.com/media/CWS0q8iU8AE2Srr.jpg,1,2294,808,Chesapeake Bay Retriever
1449,676821958043033607,2015-12-15 17:51:44+00:00,iPhone,Finally some constructive political change in this country. 11/10 https://t.co/mvQaETHVSb,11,10,,False,https://pbs.twimg.com/media/CWSN-vaXAAA8Ehr.jpg,2,25124,17605,Great Pyrenees
1450,676819651066732545,2015-12-15 17:42:34+00:00,iPhone,Watch out Airbud. This pupper is also good at the sports. 12/10 I'm thinking D1 https://t.co/1HrFdo7M0C,12,10,,True,https://pbs.twimg.com/media/CWSL4W8WsAAE4KU.jpg,2,1957,741,Labrador Retriever
1451,676811746707918848,2015-12-15 17:11:09+00:00,iPhone,Say hello to Penny &amp; Gizmo. They are practicing their caroling. The ambition in the room is tangible. 9/10 for both https://t.co/aqBHjjh5VD,9,10,Penny,False,https://pbs.twimg.com/media/CWSEsO9WwAAX-fZ.jpg,1,1536,469,Chihuahua
1453,676617503762681856,2015-12-15 04:19:18+00:00,iPhone,I promise this wasn't meant to be a cuteness overload account but ermergerd look at this cozy pupper. 13/10 https://t.co/mpQl2rJjDh,13,10,,True,https://pbs.twimg.com/media/CWPUB9TWwAALPPx.jpg,1,3149,1108,Chihuahua
1454,676613908052996102,2015-12-15 04:05:01+00:00,iPhone,This is the saddest/sweetest/best picture I've been sent. 12/10 ðŸ˜¢ðŸ¶ https://t.co/vQ2Lw1BLBF,12,10,,False,https://pbs.twimg.com/media/CWPQwmJWUAAu_At.jpg,1,1183,219,Doberman
1455,676606785097199616,2015-12-15 03:36:42+00:00,iPhone,*screeches for a sec and then faints* 12/10 https://t.co/N5QL4ySBEx,12,10,,False,https://pbs.twimg.com/media/CWPKSGpWcAQN6mw.jpg,1,2039,490,Malinois
1456,676603393314578432,2015-12-15 03:23:14+00:00,iPhone,This is Godzilla pupper. He had a ruff childhood &amp; now deflects that pain outward by terrorizing cities. Tragic 9/10 https://t.co/g1tLGkyaxr,9,10,Godzilla,True,https://pbs.twimg.com/media/CWPHMqKVAAAE78E.jpg,1,1280,440,Whippet
1457,676588346097852417,2015-12-15 02:23:26+00:00,iPhone,This is Bubbles. He kinda resembles a fish. Always makes eye contact with u no matter what. Sneaky tongue slip. 5/10 https://t.co/Nrhvc5tLFT,5,10,Bubbles,False,https://pbs.twimg.com/media/CWO5gmCUYAAX4WA.jpg,1,2533,896,Boston Bull
1458,676582956622721024,2015-12-15 02:02:01+00:00,iPhone,"Meet Vinnie. He's having fun while being safe. Well not a lot of fun, but definitely safe, and that's important 8/10 https://t.co/vZYtynZZlH",8,10,Vinnie,False,https://pbs.twimg.com/media/CWO0m8tUwAAB901.jpg,1,1310,312,Boston Bull
1459,676575501977128964,2015-12-15 01:32:24+00:00,iPhone,This pupper is very passionate about Christmas. Wanted to give the tree a hug. So cute. 8/10 https://t.co/NsGyECJuq7,8,10,,True,https://pbs.twimg.com/media/CWOt07EUsAAnOYW.jpg,1,2807,1254,Yorkshire Terrier
1460,676533798876651520,2015-12-14 22:46:41+00:00,iPhone,ITSOFLUFFAYYYYY 12/10 https://t.co/bfw13CnuuZ,12,10,,False,https://pbs.twimg.com/media/CWOH4s9U8AEtkmQ.jpg,1,2025,621,Chow
1461,676496375194980353,2015-12-14 20:17:59+00:00,iPhone,Say hello to Griffin. He's upset because his costume for Halloween didn't arrive until today. 9/10 cheer up pup https://t.co/eoBCjSFajX,9,10,Griffin,False,https://pbs.twimg.com/media/CWNl3S9WcAARN34.jpg,1,1641,602,Pug
1462,676470639084101634,2015-12-14 18:35:43+00:00,iPhone,Three generations of pupper. 11/10 for all https://t.co/tAmQYvzrau,11,10,,True,https://pbs.twimg.com/media/CWNOdIpWoAAWid2.jpg,1,12616,5224,Golden Retriever
1463,676440007570247681,2015-12-14 16:34:00+00:00,iPhone,Hope your Monday isn't too awful. Here's two baseball puppers. 11/10 for each https://t.co/dB0H9hdZai,11,10,,False,https://pbs.twimg.com/media/CWMyl9EWUAAnZJ0.jpg,2,1863,748,Maltese Dog
1464,676430933382295552,2015-12-14 15:57:56+00:00,iPhone,"Meet Duke. He's an Urban Parmesan. They know he's scared of the green rubber dog. ""Why u do dis?"" thinks Duke. 10/10 https://t.co/3bim9U5Idr",10,10,Duke,False,https://pbs.twimg.com/media/CWMqV7WUYAEEClG.jpg,1,1526,385,Golden Retriever
1465,676263575653122048,2015-12-14 04:52:55+00:00,iPhone,All this pupper wanted to do was go skiing. No one told him about the El NiÃ±o. Poor pupper. 10/10 maybe next year https://t.co/fTgbq1UBR9,10,10,,True,https://pbs.twimg.com/media/CWKSIfUUYAAiOBO.jpg,1,2243,609,Toy Poodle
1466,676237365392908289,2015-12-14 03:08:46+00:00,iPhone,Say hello to Winston. He has no respect for the system. Much rebellion. I think that's a palm tree... nice. 8/10 https://t.co/dOLQddhXLZ,8,10,Winston,False,https://pbs.twimg.com/media/CWJ6Sc-WwAAlpI6.jpg,1,1335,331,French Bulldog
1467,676219687039057920,2015-12-14 01:58:31+00:00,iPhone,This is Kenneth. He's stuck in a bubble. 10/10 hang in there Kenneth https://t.co/uQt37xlYMJ,10,10,Kenneth,False,https://pbs.twimg.com/media/CWJqN9iWwAAg86R.jpg,1,67100,31989,Whippet
1469,676191832485810177,2015-12-14 00:07:50+00:00,iPhone,These two pups just met and have instantly bonded. Spectacular scene. Mesmerizing af. 10/10 and 7/10 for blue dog https://t.co/gwryaJO4tC,10,10,,False,https://pbs.twimg.com/media/CWJQ4UmWoAIJ29t.jpg,2,2478,1145,Chihuahua
1470,676146341966438401,2015-12-13 21:07:04+00:00,iPhone,This is Bert. He likes flowers. 10/10 https://t.co/lmQRrNxaQu,10,10,Bert,False,https://pbs.twimg.com/media/CWIngp5WEAAJOy3.jpg,1,2077,744,Irish Water Spaniel
1471,676101918813499392,2015-12-13 18:10:33+00:00,iPhone,Meet Striker. He's ready for Christmas. 11/10 https://t.co/B3xxSLjQSH,11,10,Striker,False,https://pbs.twimg.com/media/CWH_FTgWIAAwOUy.jpg,1,3042,1284,Shih-Tzu
1473,676089483918516224,2015-12-13 17:21:08+00:00,iPhone,"""Yes hello I'ma just snag this here toasted bagel real quick. carry on."" 9/10 https://t.co/Cuz0Osnekp",9,10,,False,https://pbs.twimg.com/media/CWHzzFGXIAA0Y_H.jpg,1,1431,483,Bull Mastiff
1474,675898130735476737,2015-12-13 04:40:46+00:00,iPhone,I'm sure you've all seen this pupper. Not prepared at all for the flying disc of terror. 10/10 https://t.co/G0pQiFGM7O,10,10,,True,https://pbs.twimg.com/media/CWFFt3_XIAArIYK.jpg,1,1774,653,Labrador Retriever
1475,675891555769696257,2015-12-13 04:14:39+00:00,iPhone,This is Donny. He's summoning the demon monster Babadook. 6/10 Donny please no that won't be a good time for anyone https://t.co/kiW6Knb7Gp,6,10,Donny,False,https://pbs.twimg.com/media/CWE_x33UwAEE3no.jpg,1,2297,976,Italian Greyhound
1476,675888385639251968,2015-12-13 04:02:03+00:00,iPhone,Breathtaking scene. A father taking care of his newborn pup. Tugs at the heartstrings. 10/10 restores my faith https://t.co/06oZdehGEa,10,10,,False,https://pbs.twimg.com/media/CWE85snWIAEG5ES.jpg,1,2581,1067,West Highland White Terrier
1477,675878199931371520,2015-12-13 03:21:34+00:00,iPhone,"Ok, I'll admit this is a pretty adorable bunny hopping towards the ocean but please only send in dogs... 11/10 https://t.co/sfsVCGIipI",11,10,,False,https://pbs.twimg.com/media/CWEzo19WoAEiOCj.jpg,1,4531,1570,Cardigan
1478,675853064436391936,2015-12-13 01:41:41+00:00,iPhone,Here we have an entire platoon of puppers. Total score: 88/80 would pet all at once https://t.co/y93p6FLvVw,88,80,,False,https://pbs.twimg.com/media/CWEcxqWVEAAHyGH.jpg,1,2927,1460,Labrador Retriever
1479,675845657354215424,2015-12-13 01:12:15+00:00,iPhone,"This is Pepper. She's not fully comfortable riding her imaginary bike yet. 10/10 don't worry pupper, it gets easier https://t.co/40dj4eTsXG",10,10,Pepper,True,https://pbs.twimg.com/media/CWEWClfW4AAnqhG.jpg,1,2477,1000,Pug
1480,675822767435051008,2015-12-12 23:41:18+00:00,iPhone,ðŸŽ¶ HELLO FROM THE OTHER SIIIIIIIIDE ðŸŽ¶ 10/10s https://t.co/GK2HJtkdQk,10,10,,False,https://pbs.twimg.com/media/CWEBOFYWwAA-O2c.jpg,1,1652,591,Pomeranian
1481,675820929667219457,2015-12-12 23:34:00+00:00,iPhone,Here's a handful of sleepy puppers. All look unaware of their surroundings. Lousy guard dogs. Still cute tho 11/10s https://t.co/lyXX3v5j4s,11,10,,False,https://pbs.twimg.com/media/CWD_jQMWEAAdYwH.jpg,1,1140,260,Basset
1482,675798442703122432,2015-12-12 22:04:39+00:00,iPhone,This is Bernie. He just touched a boob for the first time. 10/10 https://t.co/whQKMygnK6,10,10,Bernie,False,https://pbs.twimg.com/media/CWDrGH4UYAARoq_.jpg,1,11101,3787,Beagle
1483,675781562965868544,2015-12-12 20:57:34+00:00,iPhone,Say hello to Buddah. He was Waldo for Halloween. 11/10 https://t.co/DVAqAnb624,11,10,Buddah,False,https://pbs.twimg.com/media/CWDbv2yU4AARfeH.jpg,1,1750,537,Maltese Dog
1484,675740360753160193,2015-12-12 18:13:51+00:00,iPhone,Here's a pupper licking in slow motion. 12/10 please enjoy https://t.co/AUJi8ujxw9,12,10,,True,https://pbs.twimg.com/ext_tw_video_thumb/675740268751138818/pu/img/dVaVeFAVT-lk_1ZV.jpg,1,1257,388,Golden Retriever
1485,675710890956750848,2015-12-12 16:16:45+00:00,iPhone,This is Lenny. He was just told that he couldn't explore the fish tank. 12/10 smh all that work for nothing https://t.co/JWi6YrpiO1,12,10,Lenny,False,https://pbs.twimg.com/media/CWCbd8ZWoAAtqoH.jpg,2,2046,928,Standard Schnauzer
1486,675706639471788032,2015-12-12 15:59:51+00:00,iPhone,This is a Sizzlin Menorah spaniel from Brooklyn named Wylie. Lovable eyes. Chiller as hell. 10/10 and I'm out.. poof https://t.co/7E0AiJXPmI,10,10,,False,https://pbs.twimg.com/media/CWCXj35VEAIFvtk.jpg,1,693,106,English Springer
1487,675534494439489536,2015-12-12 04:35:48+00:00,iPhone,Seriously guys?! Only send in dogs. I only rate dogs. This is a baby black bear... 11/10 https://t.co/H7kpabTfLj,11,10,,False,https://pbs.twimg.com/media/CV_7CV6XIAEV05u.jpg,1,1953,470,Chow
1488,675531475945709568,2015-12-12 04:23:49+00:00,iPhone,This is Ellie AKA Queen Slayer of the Orbs. Very self-motivated. Great yard. Rad foliage. 10/10 would pet diligently https://t.co/c9jmg3Xtzn,10,10,Ellie,False,https://pbs.twimg.com/media/CV_4ShmUYAA3wNu.jpg,1,1276,428,Pembroke
1489,675522403582218240,2015-12-12 03:47:46+00:00,iPhone,Meet Sammy. He's a Motorola Firefox. Hat under hoodie (must be a half-decent up and coming white rapper) 10/10 https://t.co/rO2zxf0OQ0,10,10,Sammy,False,https://pbs.twimg.com/media/CV_wCh8W4AEWWZ9.jpg,1,1122,316,Cocker Spaniel
1490,675517828909424640,2015-12-12 03:29:35+00:00,iPhone,12/10 stay woke https://t.co/XDiQw4Akiw,12,10,,False,https://pbs.twimg.com/media/CV_r3v4VAAALvwg.jpg,1,1414,507,Scottish Deerhound
1492,675497103322386432,2015-12-12 02:07:14+00:00,iPhone,Meet Reggie. He's going for the world record. Must concentrate. Focus up pup. 11/10 we all believe in you Reggie https://t.co/h3AWz4AzuC,11,10,Reggie,False,https://pbs.twimg.com/media/CV_ZAhcUkAUeKtZ.jpg,1,3397,1443,Vizsla
1493,675489971617296384,2015-12-12 01:38:53+00:00,iPhone,RT until we find this dog. Clearly a cool dog (front leg relaxed out window). Looks to be a superb driver. 10/10 https://t.co/MnTrKaQ8Wn,10,10,,False,https://pbs.twimg.com/media/CV_SimUWoAAvJSY.jpg,1,1406,672,West Highland White Terrier
1495,675432746517426176,2015-12-11 21:51:30+00:00,iPhone,Happy Friday. Here's some golden puppers. 12/10 for all https://t.co/wNkqAED6lG,12,10,,False,https://pbs.twimg.com/media/CV-ef64WoAAbh0I.jpg,1,1623,627,Labrador Retriever
1496,675372240448454658,2015-12-11 17:51:04+00:00,iPhone,"The tail alone is 13/10. Great dog, better owner https://t.co/IyAXinfyju",13,10,,False,https://pbs.twimg.com/media/CV9nd30XAAAEba5.jpg,1,1838,563,Chihuahua
1497,675362609739206656,2015-12-11 17:12:48+00:00,iPhone,This is Daisy. She loves that shoe. Still no seat belt. Super churlish. 12/10 the dogs are killing it today https://t.co/cZlkvgRPdn,12,10,Daisy,False,https://pbs.twimg.com/media/CV9etctWUAAl5Hp.jpg,1,1136,262,Labrador Retriever
1498,675354435921575936,2015-12-11 16:40:19+00:00,Web,Everyone needs to watch this. 13/10 https://t.co/Bb3xnpsWBC,13,10,,False,https://pbs.twimg.com/ext_tw_video_thumb/675354114423808004/pu/img/qL1R_nGLqa6lmkOx.jpg,1,35178,18963,Golden Retriever
1499,675334060156301312,2015-12-11 15:19:21+00:00,iPhone,Good morning here's a grass pupper. 12/10 https://t.co/2d68FmWGGs,12,10,,True,https://pbs.twimg.com/media/CV9EvZNUwAAgLCK.jpg,2,3007,1436,Pembroke
1500,675166823650848770,2015-12-11 04:14:49+00:00,iPhone,This is Arnold. He broke his leg saving a handicapped child from a forest fire. True hero. 10/10 inspirational dog https://t.co/bijCeHeX4C,10,10,Arnold,False,https://pbs.twimg.com/media/CV6spB7XAAIpMyP.jpg,1,3920,1795,Standard Poodle
1502,675149409102012420,2015-12-11 03:05:37+00:00,iPhone,holy shit 12/10 https://t.co/p6O8X93bTQ,12,10,,False,https://pbs.twimg.com/media/CV6czeEWEAEdChp.jpg,1,4037,1878,Chow
1503,675147105808306176,2015-12-11 02:56:28+00:00,iPhone,When you're presenting a group project and the 4th guy tells the teacher that he did all the work. 10/10 https://t.co/f50mbB4UWS,10,10,,False,https://pbs.twimg.com/media/CV6atgoWcAEsdv6.jpg,1,1026,273,Golden Retriever
1504,675146535592706048,2015-12-11 02:54:12+00:00,iPhone,This is Coops. He's yelling at the carpet. Not very productive Coops. 7/10 https://t.co/Uz52oYnHzF,7,10,Coops,False,https://pbs.twimg.com/media/CV6aMToXIAA7kH4.jpg,1,1300,349,Cardigan
1505,675145476954566656,2015-12-11 02:49:59+00:00,iPhone,What an honor. 3 dogs here. Blond one is clearly a gymnast. Other two just confused. Very nifty pups. 9/10 for all https://t.co/YDgstgIDGs,9,10,,False,https://pbs.twimg.com/media/CV6ZOPqWsAA20Uj.jpg,1,2305,1011,Labrador Retriever
